Track Name,Artist,Album,Tempo,Duration,Video ID
Kannaana Kanne,"Anirudh Ravichander,Sean Roldan",Wunderboy Anirudh,195,4:27,B_BYxNsjF08
Varavaa Varavaa,"Anirudh Ravichander,Vignesh Shivan",Naanum Rowdy Dhaan (Original Motion Picture Soundtrack),195,3:22,95e2euu9Q0w
Mundhinam,Harris Jayaraj;Naresh Iyer;Prashanthini;Thamarai,Vaaranam Aayiram (Original Motion Picture Soundtrack),194,5:41,gypxTpsjIwc
Loosu Pennae,Yuvan Shankar Raja;Silambarasan TR;Blaze,Vallavan (Original Motion Picture Soundtrack),192,6:51,s2si0jeYk00
Loosu Pennae,Silambarasan TR;Blaaze,Vallavan (Original Motion Picture Soundtrack),192,6:47,s2si0jeYk00
Kadhal Cricket - Love (Not Out),Hiphop Tamizha;Kharesma Ravichandran,Thani Oruvan (Original Motion Picture Soundtrack),190,3:33,xzxr6fxdI_E
Vaadiamma,Udit Narayan;Kabilan,Thirumalai (Original Motion Picture Soundtrack),189,5:50,7uTstF495uI
"Thanga Magan Indru Singanadai (From ""Baasha (Tamil)"")",K. J. Yesudas;K. S. Chithra,Hits Of Vairamuthu,187,5:10,CRfY5_NDIKg
Cinema Choopistha Mama,Simha Yadgiri;Malavika;Mansi;M.M.Monissha,Race Gurram,186,4:30,kiCsar38OJo
Vaan Meghangale,S. Janaki;Malaysia Vasudevan,Hits Of Ilaiyaraaja Vol. 1,183,4:53,xOVj0yz5a4U
Marudaani,A.R. Rahman;Madhushree;Hentry Kuruvila;Vaali,Sakkarakatti (Original Motion Picture Soundtrack),180,6:27,RKZNPx-K1AA
Ei Suzhali,Santhosh Narayanan;Vijaynarain;Vivek,Kodi (Original Motion Picture Soundtrack),180,3:37,6d3eVnF0CNg
En Jeevan,G. V. Prakash;Hariharan;Saindhavi;Vaikom Vijayalakshmi,Theri (Original Motion Picture Soundtrack),180,5:20,MJ7P9x4w2CM
Kadhal Vanthathum,Sadhana Sargam;K. J. Yesudas;Vairamuthu,Poovellam Unn Vaasam (Original Motion Picture Soundtrack),180,5:34,ZDdXf0wu3t0
Vaadi Pulla Vaadi,Hiphop Tamizha,Vaadi Pulla Vaadi,180,4:06,gg6nJSx9CO0
Anbe Anbe,Harris Jayaraj;Harish Raghavendra;Harini,Ithu Kathirvelan Kadhal (Original Motion Picture Soundtrack),180,5:44,lvLR3RFIO-g
"Kaarirulae - From ""Avam""",Sundaramurthy K.S.;Kamal Haasan;Madhan Karky,Avam (Original Motion Picture Soundtrack),180,4:36,UctvCWF9nAI
Sudum Nilavu,Unnikrishnan;Harini,Thambi (Original Motion Picture Soundtrack),178,4:15,smSx9MqotCI
Sudum Nilavu,Vidyasagar;Unnikrishnan;Harini,Thambi (Original Motion Picture Soundtrack),178,4:15,smSx9MqotCI
Aval Ulaghazhagi,Karthik,Lesa Lesa,177,5:09,IrigeM77rVI
En Meal Vizhundha Mazhai,P. Jayachandran;K. S. Chithra,May Madham,177,5:00,Yyk1_ER9lBw
Jimikki Ponnu,Thaman S;Anirudh Ravichander;Jonita Gandhi,Varisu,176,3:44,6NGgVDfMBXU
Enakke Enakkaa,Unnikrishnan;S.P. Pallavi;Vairamuthu,Jeans (Original Motion Picture Soundtrack),176,7:09,tck__K8H3TE
Mannipaaya,A.R. Rahman;Shreya Ghoshal;Thamarai,Vinnaithaandi Varuvaayaa (Original Motion Picture Soundtrack),176,6:56,4eyk-zC8t5M
Pachai Nirame,Hariharan;Clinton,Alaipayuthey (Original Motion Picture Soundtrack),176,5:58,ySu11Bo0PAs
Machaan Machaan,Yuvan Shankar Raja;Ilaiyaraaja;Bela Shende;Na.Muthukumar,Silambattam (Original Motion Picture Soundtrack),174,5:24,6vrBoLtuiKc
Kaadu Thirande,Bharadwaj;Hariharan;Sadhana Sargam;Vairamuthu,Vasool Raja Mbbs (Original Motion Picture Soundtrack),174,5:33,hsfRck6_IPo
Chenna Pattanam,Vidyasagar;Udit Narayan;Shruthi,Alli Thantha Vaanam (Original Background Score),174,4:44,idC40S2F9HY
Thenmadurai,S. P. Balasubrahmanyam;S. Janaki,Pavunu Pavunuthaan (Original Motion Picture Soundtrack),174,4:53,ow2Jm00HZe8
Kaattrae En Vaasal - Wind,Unnikrishnan;Kavita Krishnamurthy,Rhythm,172,6:18,gB7CRHoed_0
Enakkoru Snehidhi,S.A. Rajkumar;Hariharan;Mahalakshmi Iyer;Vaali,Priyamaanavale (Original Motion Picture Soundtrack),172,4:54,3aGSN7bBU4w
"Velli Malare (From ""Jodi"")",S. P. Balasubrahmanyam;Mahalakshmi Iyer,Hits of A.R.Rahman Nenjame,172,6:29,RlEGnwA_uB8
Mughaiyazhi,Anand Aravindakshan;Radhika,Boomerang (Original Motion Picture Soundtrack),172,3:11,0vzWNIXieSI
Sudupattadha,Kamal Haasan,Nala Dhamayanthi,172,6:18,ydrEqU1y-pE
Sollitharavaa,Madhu Balakrishnan;Sadhana Sargam,Maja,172,4:41,EyKqVLny5DM
Kannave Kannave,Thaman S;Vikram,Sketch (Original Motion Picture Soundtrack),172,5:01,ZGUdUtQ-kQg
Aadungada Yennai Suththi,Mani Sharma;Naveen,Pokkiri,172,4:30,mecMXsp_eN4
Kavidhai Iravu,Karthik;K. S. Chithra,Sullaan (Original Motion Picture Soundtrack),172,4:39,LE1bkZ7vk_U
Konjum Mainaakkale,Sadhana Sargam,Kandukondain Kandukondain,171,4:43,drJHN4XLUG4
Kutti Pisase,G. V. Prakash;Silambarasan TR;Suchitra;Vaali,Kaalai (Original Motion Picture Soundtrack),170,5:37,DYa278MkQw0
"Moongil Kaadugalae (From ""Samurai"")",Hariharan;Tippu,Hariharan's Melodies,170,6:19,B2kyb1yUbqo
Oru Ooril,Karthik;Thamarai,Kaakha Kaakha (Original Motion Picture Soundtrack),170,4:39,Kl77yEY5ErU
Domer-U Lord-U,Vishal Chandrashekhar;Anthony Daasan;Kavita Thomas,Jil Jung Juk (Original Motion Picture Soundtrack),170,2:57,wvt5ShsbJmQ
Something Something,Tippu;Pa. Vijay,Something Something Unakkum Enakkum (Original Motion Picture Soundtrack),170,5:33,uRzTUe3EQrg
Perinba Kadhal,Tenma;RANJ,Natchathiram Nagargirathu (Original Motion Picture Soundtrack),170,3:37,x7Rzebq_tTE
Siragugal,Yuvan Shankar Raja;Javed Ali;Madhushree,Sarvam,170,5:25,MvtKgQpMj8Y
Sempoove Poove,Ilaiyaraaja;S. P. Balasubrahmanyam;K. S. Chithra,Sirai Chalai (Original Motion Picture Soundtrack),170,4:57,8uyAfq2gad8
Siragugal,Yuvan Shankar Raja;Javed Ali;Madhushree,Sarvam,170,5:25,MvtKgQpMj8Y
Adada Vaa,Yuvan Shankar Raja;Ilaiyaraaja;Andrea Jeremiah;SUVI,Sarvam,170,4:33,iTmgief_iIw
Happy New Year,Vaaisan;Dr. Burn Mc.jazz;Sunidhi Chauhan,Kuruvi,169,4:03,WeJbJCGVmwE
Nenjil Nenjil,Harris Jayaraj;Chinmayi;Harish Raghavendra;Madhan Karky,Engeyum Kadhal (Original Motion Picture Soundtrack),168,5:15,3r5ELckRJAs
Malargal Kaettaen,A.R. Rahman;K. S. Chithra,O Kadhal Kanmani (Original Motion Picture Soundtrack),168,5:54,PkocselE4Bs
Appadi Podu,Vidyasagar;Anuradha Sriram;Kay Kay,Ghilli,168,4:52,iBkzrCxLoOM
Yaaro Manathile,Harris Jayaraj;Bombay Jayashri;Krish,Dhaam Dhoom (Original Motion Picture Soundtrack),167,5:03,T_wJGHL3JjE
"Who's the Hero (From ""Manmadan Ambu"")",Andrea Jeremiah,Kollywood Stars,166,4:26,ouN5sP2W-Qo
"Jugni (from ""Cocktail"")",Arif Lohar;Harshdeep Kaur;Pritam,Cocktail,166,6:57,wHJ5VJGZ3Kw
Vaathi Coming,Anirudh Ravichander;Gana Balachandar,Master (Original Motion Picture Soundtrack),165,3:48,fRD_3vJagxk
Azhagana Rakshasiyea,S. P. Balasubrahmanyam;Harini,Mudhalvan (Original Motion Picture Soundtrack),165,6:07,cIRZF72OiZA
Thavani Pootta,Vijay Yesudas;Srerayakoshi,Sandakozhi (Original Motion Picture Soundtrack),165,4:23,GWicf3QRo0o
Kattipudi Kattipudida,Deva;Vairamuthu;Vasundhara Das;Shankar Mahadevan;Ganga;Sriram,Kushi (Original Motion Picture Soundtrack),164,5:45,X3vUldIxnQ8
"Kattipudi Kattipudida (From ""Kushi"")",Shankar Mahadevan;Vasundhara Das,Vijay's Dance Hits,164,5:40,1XnSRrl3WXY
"Paisa Note (From ""Comali"")",Hiphop Tamizha;Pradeep Ranganathan;Mobin;Gana Kavi,"Paisa Note (From ""Comali"")",161,3:04,AZUY--EuBaM
"Enakenna Yaarum Illaye (From ""Aakko"")",Anirudh Ravichander;Vignesh Shivan,"Enakenna Yaarum Illaye (From ""Aakko"")",160,4:20,b_ZGAdrvpks
Neeyum Naanum Anbe,Hiphop Tamizha;Raghu Dixit;Sathyaprakash D.;Jithin Raj,Imaikkaa Nodigal (Original Motion Picture Soundtrack),160,4:45,zsP1FhlrDDc
Mental Manadhil,A.R. Rahman;Jonita Gandhi;Mani Ratnam,O Kadhal Kanmani (Original Motion Picture Soundtrack),160,3:25,T8HvXDRAeVc
"Rendu Kaadhal (From ""Kaathuvaakula Rendu Kaadhal"")",Anirudh Ravichander;Shakthisree Gopalan;Aishwarya Suresh Bindra;Vignesh Shivan,"Rendu Kaadhal (From ""Kaathuvaakula Rendu Kaadhal"")",160,4:20,YlymYnShOLw
Thoovaanam,D. Imman;Vishal Dadlani;Sunitha Sarathy;Thamarai,Romeo Juliet (Original Motion Picture Soundtrack),160,4:25,SYOELTR8VYI
Ore Oru Oorilae,Vidyasagar;Kailash Kher,Abhiyum Naanum (Original Motion Picture Soundtrack),160,4:52,xRqU0LJUMHY
"Ok Jaanu Title Track (From ""OK Jaanu"")",A.R. Rahman;Srinidhi Venkatesh,"Ok Jaanu Title Track (From ""OK Jaanu"")",160,3:26,QN507xqvG0w
Senthooran - Reprise,D. Imman;Inno Genga,Bogan (Original Motion Picture Soundtrack),160,3:47,taOaX0ec_gw
Ilayanila Pozhigirathe (From “Payanangal Mudivathillai ”),Afsal,"Ilaya Nila Pozhigirathe, Vol. 1",160,4:45,LNuYDoRyF2Y
Ammadi Aathadi,Silambarasan TR;T. Rajendar;Suchitra;Mahathi,Vallavan (Original Motion Picture Soundtrack),160,5:26,9DT4CW4UmVM
Semma Botha Aagathey,Yuvan Shankar Raja,Semma Botha Aagathey (From 'Semma Botha Aagathey'),160,2:58,hFY3ZR1Zf_M
Hello Miss,G. V. Prakash;Anushka Manchanda,Unnaale Unnaale (Original Motion Picture Soundtrack),160,4:31,hHx0_bCdU08
Dope Track,Yuvan Shankar Raja,Dope Track (From 'Pyaar Prema Kaadhal' Original Motion Picture Soundtrack),160,4:10,mRbvhHil2hI
Ennodu Nee Irundhaal,A.R. Rahman;Sid Sriram;Sunitha Sarathy;Kabilan,I (Original Motion Picture Soundtrack),158,5:52,_9r0-yosPF8
Neeyum Naanum,Anirudh Ravichander and Neeti Mohan,Wunderboy Anirudh,158,5:01,fYkQzTAx3Yo
Neeyum Naanum,Anirudh Ravichander and Neeti Mohan,Naanum Rowdy Dhaan (Original Motion Picture Soundtrack),158,5:01,fYkQzTAx3Yo
Lealakku Lealakku,Vidyasagar;Kay Kay;Sujatha,Aathi,158,4:40,1rr8YSM5AZc
Oh Baby Girl,Achu;Hemachandra Vedala,Maalai Pozhudhin Mayakathilaey (Original Motion Picture Soundtrack),157,3:46,e46x7RY9QGc
En Kanmani,S. P. Balasubrahmanyam;P. Susheela,Chittukkuruvi (Original Motion Picture Soundtrack),157,3:40,pRfoA6aIFp4
Raja Raja Chozhan,K. J. Yesudas,Rettai Vaal Kuruvi (Original Motion Picture Soundtrack),156,4:34,HyQvSZzBz_w
Manmadha - Theme Song,Viva Girls,Manmadha (Original Motion Picture Soundtrack),156,2:31,nGv0wy0Zt-4
Kalasala Kalasala,Thaman S;L. R. Eswari;T. Rajendar;Solar Sai;Vaali,Osthe (Original Motion Picture Soundtrack),155,4:10,IgJyqtFmUt0
Amma Amma (The Loss of Raghuvaran),Anirudh Ravichander;S. Janaki;Dhanush,Velai Illa Pattadhaari,155,5:04,OdVe7AUlJlU
"Maya Maya - From ""Irugapatru""",Justin Prabhakaran;Karthik Netha;Christopher Stanley;Padmapriya Raghavan,"Maya Maya (From ""Irugapatru"")",154,4:10,hE_MxaE5C88
Njan Chendena,Vijay Yesudas;Swetha,Bahubali (Original Motion Picture Soundtrack),154,5:32,RdaIHU4aO_c
Oh Raaya,A.R. Rahman;Ganavya;Dhanush,Raayan (Original Motion Picture Soundtrack),153,3:27,QyEdtZyYEfA
"Vaan (From ""Kaatru Veliyidai"")",A.R. Rahman;Shashaa Tirupati,"Vaan (From ""Kaatru Veliyidai"")",151,4:15,DOfYwN6lFiM
Putham Pudhu,K. J. Yesudas;S. Janaki,Thalapathi,151,4:56,SafTrA4DlIc
Ondra Renda,Bombay Jayashri;Thamarai,Kaakha Kaakha (Original Motion Picture Soundtrack),150,5:06,Av6NpfF_yl0
"Megham Karukatha (From ""Thiruchitrambalam"")",Dhanush;Anirudh Ravichander,"Megham Karukatha (From ""Thiruchitrambalam"")",150,4:50,rTDUuEwvBG8
Neeyae,Vivek - Mervin;Arijit Singh;Mervin Solomon,Pugazh (Original Motion Picture Soundtrack),150,4:42,zCj02sjq9kA
Naane Varugiraen,A.R. Rahman;Shashaa Tirupati;Sathyaprakash,O Kadhal Kanmani (Original Motion Picture Soundtrack),150,6:05,Hp4wk9ptjCQ
Unakkulle Mirugam,Yuvan Shankar Raja;Ranjith Govind,Billa 2 (Original Motion Picture Soundtrack),150,4:18,BsHfA8Ou3U0
CEO in the House,A.R. Rahman;Nakul Abhyankar;Blaaze,Sarkar (Tamil) [Original Motion Picture Soundtrack],150,3:52,XLbjnXq3IL4
Un Paarvaiyilae,Dharan Kumar;Sindhu;M.M.Monissha;Pradeep,Podaa Podi (Original Motion Picture Soundtrack),150,2:17,xAzuzp3hMps
"Timeless Love (From ""Custody"")",Yuvan Shankar Raja;Kapil Kapilan;Ilaiyaraaja;Madan Karky,"Timeless Love (From ""Custody"")",150,4:10,53FOFxOCmqs
High On Love,"Yuvan Shankar Raja,Sid Sriram","High On Love (From ""Pyaar Prema Kaadhal"" Original Motion Picture Soundtrack)",150,4:00,3ZxZ9uldTZk
Soora Thenga,Vidyasagar;Tippu,Ghilli,150,4:02,wDg2NSDFrZU
Anbe Sivam,Kamal Haasan;Karthik,Anbe Sivam (Original Motion Picture Soundtrack),150,4:21,CNibXXAMeow
Sandakozhi,Vidyasagar;Shankar Mahadevan,Sullaan (Original Motion Picture Soundtrack),150,4:50,A39M6u2_B0k
"Aathi (From ""Kaththi"")",Anirudh Ravichander;Vishal Dadlani,Kaththi (Original Motion Picture Soundtrack),150,5:04,YQ6ShcAU_dQ
Kanne Un Kadhal,Yuvan Shankar Raja,Idhu Namma Aalu (Original Motion Picture Soundtrack),150,4:32,9AtY9ToeNok
Oru Thalai Ragam (Version 1),Sriram Parthasarathy;Blaaze,Idhu Namma Aalu (Original Motion Picture Soundtrack),150,4:40,jgwzQ9grJpw
Sunrise Theme,Anirudh Ravichander,Velai Illa Pattadhaari (Original Motion Picture Soundtrack),150,1:08,PrPuY0xS_qg
Hey Baby,Shankar Mahadevan,Aegan (Original Motion Picture Soundtrack),150,4:34,6mI19J1s6aA
The Boss,A.R. Rahman;Blaaze;Naresh;Raqueeb Alam,Sivaji The Boss (Original Motion Picture Soundtrack),149,3:16,uXPFMANE-0k
The Boss,Naresh Iyer;Blaaze;Raqueeb Alam;A.R. Rahman,Sivaji,149,3:18,uXPFMANE-0k
Halena,Harris Jayaraj;Christopher Stanley;Abhay Jodhpurkar;Ujjayinee Roy;Madhan Karky,Iru Mugan (Original Motion Picture Soundtrack),148,4:48,1VGbZMl1oYw
Tham Thaka,Tippu;Karthik;Na.Muthukumar,Thirumalai (Original Motion Picture Soundtrack),148,4:39,RvhAMkc9-c8
"Apple Crumble - From ""Lover""",Sean Roldan;Siddharth,Lover (Original Motion Picture Soundtrack),148,2:57,g6jbkUnxFhA
"Aruva Meesai (From ""Dhol"")",Manikka Vinayagam;Vithu Prabakar,Hits of Vidyasagar,148,4:44,MfBtqfmUDnU
"Nilavupattu (From ""Kannukul Nilavu"")",Hariharan,Magical Moments with Ilayaraja,148,6:01,PlmYE_q51tc
Germanien Senthan,S. Janaki;S. P. Balasubrahmanyam,Ilaiyaraaja - The Passion Of The Early Years,148,5:41,5quc6FAfkkw
"Parayuvaan - From ""Ishq""",Sid Sriram;Neha S. Nair;Jakes Bejoy;Joe Paul,"Parayuvaan (From ""Ishq"")",147,4:37,IWOPRFRNj3g
Aasaiye Kaathule,S. P. Sailaja,Jhonny (Original Motion Picture Soundtrack),147,4:40,rvqMZjayb_8
Raati - Madras Gig,Santhosh Dhayanidhi;Bamba Bakya;Mohanrajan,Raati (Madras Gig),146,3:55,CjodB1lAT90
Vendum,Sean Roldan;Meenakshi Elayaraja;Horn Flakes,Vendum,146,4:21,dhv9m3YYoGM
Mannil Indha,S. P. Balasubrahmanyam,Keladi Kannmanii (Original Motion Picture Soundtrack),146,4:12,SbKaWenqyow
Jillunu Oru Kadhal,A.R. Rahman;Tanvi Shah;Bhargavi,Silunu Oru Kadhal,146,4:18,0i_SHTQS6OE
Po Indru Neeyaga,Anirudh Ravichander;Dhanush,Velai Illa Pattadhaari (Original Motion Picture Soundtrack),145,3:43,ADJSD_oh5nU
Paakatha,Devi Sri Prasad;Tippu;Sumangaly,Aaru,145,4:21,tmNbVdYst2w
Eppadio Mattikiten,Ab1shanth,Siva Manasula Shakti,145,4:48,O1BkogLSCsk
Eppadio Mattikiten,Clinton Cerejo;Nruthya,Siva Manasula Sakthi (Original Motion Picture Soundtrack),145,4:48,O1BkogLSCsk
Love,Yuvan Shankar Raja,Siva Manasula Sakthi (Original Soundtrack),145,0:26,LmlIUax4ZFg
Vaseegara,Bombay Jayashri,Minnalae,144,4:59,PYgcJpC6WAQ
Aaruyire,A.R. Rahman;Chinmayi;Murtuza Khan;Qadir Khan;Vairamuthu,Guru (Original Motion Picture Soundtrack),144,5:08,_f8dMFzYRCE
Kadhal Oru Aagayam,Hiphop Tamizha;Teejay;Al Rufian,Imaikkaa Nodigal (Original Motion Picture Soundtrack),144,2:41,lOwLnk20tN0
"Elangathu (From ""Pithamagan"")",Shreya Ghoshal;Sriram Parthasarathy,Shreya Ghoshal - Sing for You,144,6:09,0M8PKEeYkB8
Kannukulle,Manikka Vinayagam,Dhill (Original Motion Picture Soundtrack),144,4:44,YCoueQaSLck
"Muthana Muthallavo - From ""Nenjil Or Aalayam""",P. Susheela,P. Susheela - Birthday Special - Tamil,144,3:40,I2f66z7dUU0
"Vaseegara - From ""Minnale""",Bombay Jayashri,Hits of Bombay Jayashree,144,4:59,ew1fKCWb_M4
"Saarattu Vandiyila (From ""Kaatru Veliyidai"")",A.R. Rahman;A.R. Reihana;Tippu;Nikhita Gandhi;Vairamuthu,"Saarattu Vandiyila (From ""Kaatru Veliyidai"")",143,4:49,ohTp4kGjZ1Q
Theradi Veethiyl,Manikka Vinayagam;Karthik,Run,143,4:58,tcEUSn9gu54
Pogiren,Mugen Rao;Prashan Sean,Pogiren,142,4:03,PYpHtsBoLS8
Nenjinile,S. Janaki,Uyire (Original Motion Picture Soundtrack),142,5:02,UKKEm8NraJQ
Unakkenna Venum Sollu,Harris Jayaraj;Benny Dayal;Mahathi;Thamarai,Yennai Arindhaal (Original Motion Picture Soundtrack),142,5:08,jIerm_0hCGI
"Nenjinile (From ""Uyire"")",S. Janaki,Hits of A.R.Rahman Isai Saral,142,5:02,UKKEm8NraJQ
Devadhai Vamsam,K. S. Chithra;Sujatha,Snegithiye (Original Motion Picture Soundtrack),142,4:52,rtGz4VaMfXo
Naanamo,P. Susheela;T. M. Soundararajan,Aayirathil Oruvan,142,4:40,HpMshzNxdoA
"Ponnondru Kandaen (From ""Padithaal Mattum Podhuma"")",P. B. Sreenivas;T. M. Soundararajan,Singha Kuralon TMS,142,3:15,C8r1jeZdwZc
Yenti Yenti,Devi Sri Prasad;Sagar;Srinidhi Sriprakash,Puli (Telugu) [Original Motion Picture Soundtrack],142,4:14,PO_pU2m9G1Q
Minnalai Pidithu,Unni Menon,Shajahaan,141,4:51,Nc9ENn1WXf4
Sandhikkatha Kangalil,K. S. Chithra;Unni Menon;S. Sowmya;Madhan Karky,180 (Original Motion Picture Soundtrack),141,3:38,Nf1RcWyLaA0
Munbe Vaa,A.R. Rahman;Naresh Iyer;Shreya Ghoshal,Silunu Oru Kadhal,141,5:56,_Z6wxp-WPjw
Athithom,S. P. Balasubrahmanyam;Vaishali,Chandramukhi,141,4:35,nvx9CEqgonU
Ilamai Ennum Poonkaatru,S. P. Balasubrahmanyam,Pagalil Oru Iravu (Original Motion Picture Soundtrack),141,4:07,5gjmeNLDnWE
Vallava Ennai,Sunitha Sarathy,Vallavan (Original Motion Picture Soundtrack),141,6:24,UsU8G81ggT4
Munbe Vaa,A.R. Rahman;Shreya Ghoshal;Naresh Iyer,Silunu Oru Kadhal,141,5:56,_Z6wxp-WPjw
Vaanamunna,Yuvan Shankar Raja;Shankar Mahadevan;Sriram,Manmadhan (Original Motion Picture Soundtrack),141,5:05,KNDHRAplvO8
Naan Nee,Santhosh Narayanan;Shakthisree Gopalan;Dhee,Madras (Original Motion Picture Soundtrack),140,4:13,Azug2MjwhHI
Why This Kolaveri Di? - The Soup of Love,Anirudh Ravichander;Dhanush,3 (Original Motion Picture Soundtrack),140,4:20,YR12Z8f1Dh8
Vinnaithaandi Varuvaayaa,A.R. Rahman;Karthik;Vivek Agrawal,Vinnaithaandi Varuvaayaa (Original Motion Picture Soundtrack),140,3:12,0Pbfd80JcAI
Iraiva,Anirudh Ravichander;Jonita Gandhi,Velaikkaran (Original Motion Picture Soundtrack),140,4:54,N6ZQsHemZ6E
Lesa Parakkudhu,V. Selvaganesh;Chinmayi;Karthik,Vennila Kabadi Kuzhu (Original Motion Picture Soundtrack),140,4:50,24mVU4B7AwE
Billa 2 Theme,Yuvan Shankar Raja,Billa 2 (Original Motion Picture Soundtrack),140,1:55,kXnUueeKedY
A Broken Heart - Background Score,Anirudh Ravichander,Remo Special (Original Background Score + Additional Song),140,1:22,1fniX8MQpAc
Sada Sada,Karthik,Kavalan (Original Motion Picture Soundtrack),140,4:13,auB6br9WMPc
Jigar,Santhosh Narayanan;Pradeep Kumar,Jigarthanda (Original Motion Picture Soundtrack),140,3:27,O2Tbzz7iMeI
Yaen Ingu Vandhaan,Thaman S;Pooja AV;Madhan Karky,Meaghamann (Original Motion Picture Soundtrack),140,4:10,f7rdM-K0Nlw
"Annathe Sethi - From ""Tughlaq Durbar""",Arivu;Govind Vasantha,"Annathe Sethi (From ""Tughlaq Durbar"")",140,4:19,9vBPcMFN81Q
Im Back,Yuvan Shankar Raja,Billa (Original Soundtrack),140,0:42,f087aSLy2iM
"Neeye Unakku Raja - From ""Thoongaavanam""",Ghibran;Kamal Haasan;Aishvarrya;Yazin Nizar,"Neeye Unakku Raja (From ""Thoongaavanam"")",140,4:32,pi2LHhSons8
Urugudhe Maragudhe,G. V. Prakash;Shreya Ghoshal;Shankar Mahadevan,Veyil (Original Motion Picture Soundtrack),140,5:56,Lefa3v-Tkjk
,,,140,,b68HETiNO98
Chandira Mandalathai,Vijay;Harini;S.P. Charan,Nilaave Vaa,140,4:42,1c4BwZWgdtY
Devuda Devuda,S. P. Balasubrahmanyam,Chandramukhi,140,5:17,YPGxr2KWNr0
Kokku Para Para,Tippu;Manikka Vinayagam,Chandramukhi,140,4:53,xuoTSc1Wz6Q
"Therikkudhu Masss (From ""Masss"")",Yuvan Shankar Raja;Shankar Mahadevan;Ranjith Govind,Masss (Original Motion Picture Soundtrack),140,4:43,0CMZr2wP1fE
Endhira Logathu Sundariye,"Sid Sriram,Shashaa Tirupati",2.0 [Tamil] (Original Motion Picture Soundtrack),140,5:29,fChxPoKGPI0
Raajali,"Blaaze,Arjun Chandy,Sid Sriram",2.0 [Tamil] (Original Motion Picture Soundtrack),140,4:10,CHYfO--S40g
Mayakkam Yenna - Theme Music,G. V. Prakash,Mayakkam Yenna (Original Motion Picture Soundtrack),140,2:51,qvdyLwEuK1g
Theme Music,Yuvan Shankar Raja,Billa (Original Motion Picture Soundtrack),140,1:45,9WumRrmHXI8
Naan Meendum,Yuvan Shankar Raja;Deepika Varadarajan,Billa (Original Motion Picture Soundtrack),140,4:45,snVTWFgy0CY
"Unnai Thaney Thanjam (From ""Nallavanukku Nallavan"")",K. J. Yesudas;Manjula,Endrum Raaja,139,4:11,MFVnmfCqVXg
"Illamai Etho Etho (From ""Sakalakala Vallavan"")","S. P. Balasubrahmanyam, S. Janaki",SPB - The Voice For A Millennium,139,5:49,FxAhwJR3d0M
Muzhumathi,A.R. Rahman;Srinivas;Na.Muthukumar,Jodhaa Akbar (Tamil) [Original Motion Picture Soundtrack],138,5:12,e4E01E-Q2Gk
"Single Pasanga - From ""Natpe Thunai""",Hiphop Tamizha;Gana Balachandar;Gana Ulagam Dharani;Arivu,"Single Pasanga (From ""Natpe Thunai"")",138,3:44,ybxt5dBVg5w
Love BGM 2,A.R. Rahman,Sillunu Oru Kaadhal (Original Soundtrack),138,2:04,oyuFngJnY8w
Thodu Vaanam,Harris Jayaraj;Hariharan;Shakthisree Gopalan;Vairamuthu,Anegan (Original Motion Picture Soundtrack),137,5:15,it34xdsiicM
Mun Andhi,Harris Jayaraj;Karthik;Megha;Na.Muthukumar,7 Aum Arivu (Original Motion Picture Soundtrack),137,6:16,O9Ma-SrEckU
Kannalay Miya Miya,Vidyasagar;Unni Menon;Srivardhani Kuchi,Alli Thantha Vaanam (Original Background Score),137,4:54,YU2XIzKDuRw
Yamune Aatrile,Mithali,Thalapathi,137,1:52,KV8Wpnpm_lg
"Pudichirukku (From ""Saamy"")",Harris Jayaraj;Hariharan;Komal Ramesh;Mahathi,Saamy (Original Motion Picture Soundtrack),137,5:03,l9itqELxH0E
Uyirin Uyire,Krishnakumar Kunnath;Suchitra;Thamarai,Kaakha Kaakha (Original Motion Picture Soundtrack),136,5:21,yul_JVWKgZE
Where Is the Party,Yuvan Shankar Raja;Mukesh;Priyadharshini;Silambarasan TR,Silambattam (Original Motion Picture Soundtrack),136,5:18,o3QMufOwuE8
Thean Kudika,Teejay;Pragathi,Maze in Idhayam,136,4:14,q6epwofsmwY
"Puthiya Vaanam - From ""Anbe Vaa""",T. M. Soundararajan,T.M. Soundararajan - Tamil Hits,136,5:59,tY7wmv-UDGQ
Innum Konjam Neram,A.R. Rahman;Vijay Prakash;Shweta Mohan;Kabilan,Maryan (Original Motion Picture Soundtrack),135,5:13,-zY2eMZwkdo
Aathadi Aathadi,Harris Jayaraj;Bhavatharini;Tippu;Dhanush;Abhay Jodhpurkar;Vairamuthu,Anegan (Original Motion Picture Soundtrack),135,5:52,9uU58WcBYwA
Nee Tholaindhaayo,Leon James;Sid Sriram,Kavalai Vendam (Original Motion Picture Soundtrack),135,3:42,hUoy4KB3SHI
Radhai Manathil,K. S. Chithra;Sujatha,Snegithiye (Original Motion Picture Soundtrack),135,7:13,pNUQ9AnI5s8
Kaathadi,Anand Kashinath;Sublahshini,Kaathadi,135,3:23,kvik-fRe4qg
En Kannodu,Yuvan Shankar Raja;Nidesh Gopalan,Arinthum Ariyamalum (Original Motion Picture Soundtrack),135,3:24,6J5HgnU_Wf8
Nurse Fight Theme - Background Score,Anirudh Ravichander,Remo Special (Original Background Score + Additional Song),135,1:44,Mhy9yMjR-Tk
En Kannodu (Lofi Flip),Narendar Sankar;Yuvan Shankar Raja,En Kannodu (Lofi Flip),135,2:07,4vofsj3qzkE
"Adi Ennadi Raakkamma (From ""Pattikkada Pattanama"")",T. M. Soundararajan,Singha Kuralon TMS,135,3:39,m7h-dLL8fEA
Kundu Kundu,Vidyasagar;Krishnakumar Kunnath;Sunidhi Chauhan;Pop Shalini,Dhool (Original Motion Picture Soundtrack),135,4:55,lQdupLyD_8g
Nee Mutham Ondru (Remix),Mani Sharma;Ranjith Govind;Shweta Mohan,Pokkiri,135,4:10,9eAmtM4xuw0
Karpoora Bommai,P. Susheela,Keladi Kannmanii (Original Motion Picture Soundtrack),134,4:19,cfOLbUiTtVQ
"Yaanji - From ""Vikram Vedha""",Sam C.S.;Anirudh Ravichander;Shakthisree Gopalan,"Yaanji (From ""Vikram Vedha"")",133,4:30,bWK3EuroEk4
Anbil Avan,A.R. Rahman;Chinmayi;Devan Ekambaram;Thamarai,Vinnaithaandi Varuvaayaa (Original Motion Picture Soundtrack),133,4:11,XU6wuDyTQ8k
Thenmadurai Vaigai Nadhi,Ilaiyaraaja;S. P. Balasubrahmanyam;P. Susheela;Malaysia Vasudevan,Dharmathin Thalaivan (Original Motion Picture Soundtrack),133,4:32,ASmkb3qeYt8
Oh! Shanthi Shanthi,Harris Jayaraj;Clinton;S.P. Charan;Thamarai,Vaaranam Aayiram (Original Motion Picture Soundtrack),133,3:03,fm5a-mDFiPk
"So Baby (From ""Doctor"")",Anirudh Ravichander;Ananthakrrishnan;Sivakarthikeyan,"So Baby (From ""Doctor"")",133,4:12,fOyGnZPy0vo
Ragasiya Kanavugal,Hariharan;Madhushree,Bheema (Original Motion Picture Soundtrack),133,5:59,03RELkOCVbU
Suthudhu Suthudhu,Vidyasagar;Hariharan,Kanden Kadhalai (Original Motion Picture Soundtrack),133,4:14,hwbrYu4JFPc
Poo Vaasam,Vidyasagar;Vijay Prakash;Sadhana Sargam,Anbe Sivam (Original Motion Picture Soundtrack),133,4:27,MuxaZeR0thQ
Idhu Kaadhala,Yuvan Shankar Raja,Thulluvadho Ilamai (Original Motion Picture Soundtrack),133,4:31,jucmE-_8Yn8
+1,Tourist;Gold Panda,+1,133,3:23,CvpwF2mrhl4
Idhu Kadhala Mudhal Kadhala (Trap Remix),Yuvan Shankar Raja;Sharan kumar;Prags,Idhu Kadhala Mudhal Kadhala (Trap Remix) - Single,133,1:10,pmT2kp-tn9s
Poovasam,Vijay Prakash;Sadhana Sargam,Anbe Sivam (Original Motion Picture Soundtrack),133,4:29,6sL_mCO6-1Y
Poovasam,Vijay Prakash;Sadhana Sargam,Anbe Sivam (Original Motion Picture Soundtrack),133,4:29,6sL_mCO6-1Y
Idhayathai Yedho Ondru,Harris Jayaraj;Chinmayi;Thamarai,Yennai Arindhaal (Original Motion Picture Soundtrack),132,3:55,xCQE1R07FwM
Manasukkulle Dhagam,Harish Raghavendra;Reshmi,Autograph (Original Motion Picture Soundtrack),132,5:22,Uoz5cjRS0aU
Silendra Theepori,Sujatha,Thithikkuthdhe (Original Motion Picture Soundtrack),132,5:21,mJ1FJuM4Jjw
"Silendra Theepori (""From Thithikkudhe"" )",Sujatha,Hits of Sujatha,132,5:21,al3L2Dhyb5M
Paarkaadhey Oru Madhiri,A.R. Rahman,Ambikapathy (Original Motion Picture Soundtrack),132,4:18,m0aQMnql25A
Naan Varaindhu Vaitha,Vidyasagar;Hariharan;Madhushree,Jeyam Kondan (Original Motion Picture Soundtrack),132,4:19,0ImB09xagxk
"Ninaivo Oru (From ""Sikappu Rojakkal"")",S. Janaki;Kamal Haasan,"Hits of Ilaiyaraaja, Vol. 1",132,4:45,bd6-eyl87j8
Daddy Mummy,Devi Sri Prasad,Villu,132,4:20,6VLcJC1uHD4
Down Down Duppa,Sooraj;Suchith;Bindhu;Mansi,Race Gurram,132,3:59,WNTBc_NEeY0
Style,"Blaaze;Tanvi Shah;Ravi ""Rags"" Khote;Suresh Peters",Sivaji,132,5:09,FvT4FIC3pyI
Yaro Yarodi,Mahalakshmi Iyer;Vaishali;Richa Sharma,Alaipayuthey,131,5:47,QYr1OLSm7Q8
Seval Kodi,Yuvan Shankar Raja;Pa. Vijay;Vijay Yesudas,Billa (Original Motion Picture Soundtrack),131,4:52,TfdKurHaYlE
Nee Kavithaigala,Dhibu Ninan Thomas;Pradeep Kumar,Maragatha Naanayam (Original Motion Picture Soundtrack),130,4:36,iYmh2jIR0Ms
Sirukki Vaasam,Santhosh Narayanan;Anand Aravindakshan;Shweta Mohan;Vivek,Kodi (Original Motion Picture Soundtrack),130,4:34,4WSxp-9Eddw
Mazhai Kuruvi,A.R. Rahman;Vairamuthu,Chekka Chivantha Vaanam (Original Motion Picture Soundtrack),130,5:48,eXxoXHDZWXY
Moongil Thottam,A.R. Rahman;Abhay Jodhpurkar;Harini;Vairamuthu,Kadal (Original Motion Picture Soundtrack),130,4:35,8jUbbUlG-jI
