Track Name,Artist,Album,Tempo,Duration,Video ID
Kaadhal Endral,Yuvan Shankar Raja;Gangai Amaran,Goa (Original Motion Picture Soundtrack),130,1:27,RBjxvFm9DvY
Kannukkul Kannai,A.R. Rahman;Naresh Iyer,Vinnaithaandi Varuvaayaa (Original Motion Picture Soundtrack),130,3:52,4ZHKtLuQpGk
Naan Romba,Ranjith Govind,Siruthai (Original Motion Picture Soundtrack),130,4:05,mjxTseV37dk
Vishwaroopam,Shankar-Ehsaan-Loy;Suraj Jagan,Vishwaroopam (Tamil) [Original Motion Picture Soundtrack],130,4:23,SQ_9xwh8y78
Theeratha Vilaiyattu,Yuvan Shankar Raja;Andrea Jeremiah;Tanvi Shah;Ranjith Govind;Vinaita Sivakumar,Theeratha Vilayaatu Pillai (Original Motion Picture Soundtrack),130,4:55,hXCXXbB3SOw
Po Nee Po - Remix - The Scream of Love,Anirudh Ravichander;Sathyaprakash;Harish Swaminathan,3 (Original Motion Picture Soundtrack),130,3:43,-E_7IPkPeKg
Goa,Yuvan Shankar Raja;Krishh;Ranjith Govind;Tanvi Shah;Suchitra,Goa (Original Motion Picture Soundtrack),130,4:40,RacDhuI_WIs
The Ecstacy of Dance,G. V. Prakash;Kiran;Chennai Symphony,Thalaivaa (Original Motion Picture Soundtrack),130,2:11,3b6mJIE8e-w
Goa - Club Mix,Yuvan Shankar Raja,Goa (Original Motion Picture Soundtrack),130,5:06,bzwAlyBRtlI
Naan Aval Illai,Karthik;Chinmayi,Masss (Original Motion Picture Soundtrack),130,4:36,bCErcL18-4Y
Kannukkul Kannai,A.R. Rahman;Naresh Iyer,Vinnaithaandi Varuvaayaa (Original Motion Picture Soundtrack),130,3:52,4ZHKtLuQpGk
Mazhai Mazhai,Harris Jayaraj;Unnikrishnan;Harini,Ullam Ketkume,130,4:55,z95_RF11RlU
Kadhal Pisase,Udit Narayan;Sujatha,Run,130,4:39,IB0e_CWvCJg
Thoduvaen,Haricharan;Maya,Deepavali (Original Motion Picture Soundtrack),130,5:47,x_93vvnLvMg
Pala Pala,Hariharan,Ayan,130,5:25,MIr1BGfFx2w
Machakari,A.R. Rahman;Shankar Mahadevan;Vasundhara Das,Sillunu Oru Kaadhal (Original Motion Picture Soundtrack),130,5:32,LLF0rCybnE0
Poyisonna Posikiduven,A.R. Rahman;Shashaa Tirupati;Nikhita Gandhi;Madhan Karky,99 Songs (Tamil) [Original Motion Picture Soundtrack],129,5:25,1Abr7utMjL4
Konjam Neram,Asha Bhosle;Madhu Balakrishnan,Chandramukhi,129,4:31,BrUyVaqvNBI
Palaanadhu Palaanadhu,Vidyasagar;Rajalakshmi,Kuruvi,129,4:11,bhcw2_SxCXA
Palanadhu Palanadhu,Vidyasagar;S. Rajalakshmi,Kuruvi (Original Motion Picture Soundtrack),129,4:11,ZYlsT4XYYSo
Idhu Enna,Harish Raghavendra;Uma Ramanan,Sivakasi,129,4:56,wzL0Yc1jzu8
Indru Netru Naalai,Hiphop Tamizha;Shankar Mahadevan;Aalaap Raju,Indru Netru Naalai (Original Motion Picture Soundtrack),128,3:05,ITzFSB9367w
Maacho,A.R. Rahman;Sid Sriram;Shweta Mohan;Vivek,Mersal (Original Motion Picture Soundtrack),128,4:35,MmvpbLdaIRs
Azhage,Hiphop Tamizha Aadhi,Kathakali (Original Motion Picture Soundtrack),128,3:38,_pWbGagRWsY
Prabalamagavey,Santhosh Narayanan;Siddharth,Enakkul Oruvan (Original Motion Picture Soundtrack),128,4:50,bhdgrzZuGwo
En Pulse Yethitu Poriye,Leon James;Inno Genga;Andrea Jeremiah;ADK,Kavalai Vendam (Original Motion Picture Soundtrack),128,3:59,rOfKW3zW-1s
Maruvaarthai,Darbuka Siva;Sid Sriram,Enai Noki Paayum Thota (Original Motion Picture Soundtrack),128,5:56,L-KkDLfaGD4
"Unnakkenna Melae (From ""Simla Special"")",S. P. Balasubrahmanyam,SPB - The Voice For A Millennium,128,4:24,5A3vUWuNEM0
Unnai Kaanadhu Naan,Shankar-Ehsaan-Loy;Kamal Haasan;Shankar Mahadevan,Vishwaroopam (Tamil) [Original Motion Picture Soundtrack],127,5:37,0GQBQE37BAE
Kannalane,K. S. Chithra;A.R. Rahman;Chorus,Bombay,127,5:52,8453jc5h0XE
New York,A.R. Rahman,Silunu Oru Kadhal,127,6:18,Z8K8UECe-nk
New York,A.R. Rahman,Silunu Oru Kadhal,127,6:18,Z8K8UECe-nk
Mayilirage - Remix,DJ Kharish,Mayilirage (Remix),127,1:20,UHtr6WS-8ok
Mersalaayitten,A.R. Rahman;Anirudh Ravichander;Neeti Mohan;Kabilan,I (Original Motion Picture Soundtrack),126,5:04,35E4DKnXXCg
"Kanmani Anbodu Kadhalan (From ""Guna"")",Kamal Haasan;Vaali;S. Janaki;Ilaiyaraaja,Guna (Original Motion Picture Soundtrack),126,5:35,meYkc2jbioA
Enna Saththam Indha Neram,S. P. Balasubrahmanyam,Punnagai Mannan (Original Motion Picture Soundtrack),126,4:16,an6IBTTwdNA
Unnodu Vazhatha,Bharadwaj;K. S. Chithra,Amarkalam (Original Background Score),126,5:18,2jkTdl9wI40
Evan Di Una Pethan,"Silambarasan,Yuvan Shankar Raja",Vaanam,126,5:54,THY7R_C2Efc
"Ooru Sanam Thoongidichu (From ""Mella Thirandhadhu Kadhavu"")",S. P. Balasubrahmanyam;S. Janaki;Ilaiyaraaja;Gangai Amaran;Vaali,Mella Thirandhadhu Kadhavu (Original Motion Picture Soundtrack),125,4:38,XeUkGUlpVNw
En Jannal Vandha,Yuvan Shankar Raja;Roshini;Priya Hemesh;Divya Vijay,Theeratha Vilayaatu Pillai (Original Motion Picture Soundtrack),125,4:43,NfAA9FAaO7M
Pathinettu Vayasil,Vidyasagar;Udit Narayan;Sadhana Sargam,Villain (Original Motion Picture Soundtrack),125,5:22,OTogHfl386c
Ranjithame,Thaman S;Thalapathy Vijay;M.M.Manasi,Varisu,125,4:47,rd1bbljtpds
Ippavae Ippavae,Vidyasagar;Madhu Balakrishnan;Harini,Raman Thediya Seethai (Original Motion Picture Soundtrack),125,4:15,SsNm1RzNf0E
Thediyae Thediyae,G. V. Prakash;Andrea Jeremiah,Va Quarter Cutting (Original Motion Picture Soundtrack),125,5:31,pydfI5FfuKU
"Holá Amigö (From ""Rum"")",Anirudh Ravichander;Balan Kash;Madhan Karky,"Holá Amigö (From ""Rum"")",125,4:16,3XSmOrcqwFE
Kannamma,"Pradeep Kumar,Dhee,Ananthu",Kaala (Tamil) (Original Motion Picture Soundtrack),125,4:49,LzVNkyulU5o
Ooru Sanam Thoongidichu,S. P. Balasubrahmanyam;S. Janaki,Mella Thirandhadhu Kadhavu (Orignal Motion Picture Soundtrack),125,4:38,REzVhJ2ES_A
Chalta Parinam,Jaya Ragopaljaidev,Sabse Bada Khiladi (Original Motion Picture Soundtrack),125,4:00,IVLsB2x89kY
"Kangal Kandadhu (From ""Oru Kalluriyin Kadhai"")",Ranjith Govind;Ganga,Youth Beats - Hits of A.R.Rahman and Yuvan Shankar Raja,125,4:47,fqqD7w3RqIc
Venmathiye,Tippu,Minnalae,124,5:26,Tn92Ll5SThY
Private Party,Anirudh Ravichander;Jonita Gandhi;Sivakarthikeyan,Don (Original Motion Picture Soundtrack),124,3:36,bMBW9r4AZGU
Rain Dance: A Tin Theme,G. V. Prakash,Trisha Illana Nayanthara (Original Motion Picture Soundtrack),124,3:05,a0SL3U2C1sg
Kokkarakko,Vidyasagar;Udit Narayan;Sujatha,Ghilli,124,4:35,HCrFyKbbFE0
Aadiyala Kathadicha,Vidyasagar;S. P. Balasubrahmanyam,Villain (Original Motion Picture Soundtrack),123,1:30,uyeQWMWjVlk
Dhinakkudha,Santhosh Narayanan;Gana Bala,Pizza (Original Motion Picture Soundtrack),123,3:03,Y9EbGX8JAtU
"Dhinakkudha - From ""Pizza""",Gana Bala,Hits of Gaana Bala,123,3:03,uWlPmte3MRg
"Mercury Poove (From ""Pudhiya Geethai"")",Nidheesh Gopalan;Bhavatharini,Vijay Hits,123,4:36,8Uo9_WgM-Tw
Poongatrile,Unni Menon;Swarnalatha,Uyire (Original Motion Picture Soundtrack),122,5:40,nyJMwfR9vIE
Anbae Anbae,Hariharan;Anuradha Sriram;Vairamuthu,Jeans (Original Motion Picture Soundtrack),122,5:32,CWj7jT3nR5E
Mayilrage,Madhusree;Naresh Iyer,Anbe Aaruyire (Original Motion Picture Soundtrack),122,5:22,G1t7cqpLVas
Suttamla Soosi,Yuvan Shankar Raja;Anurag Kulkarni;Sri Harsha Emani,Gangs Of Godavari,122,3:22,9WJDYy-9zAE
Gangster,Yuvan Shankar Raja;Stefny,Billa 2 (Original Motion Picture Soundtrack),122,4:07,jYHS4llPbpc
Yedhedho Ennam Valarthen,K. S. Chithra,Punnagai Mannan (Original Motion Picture Soundtrack),122,4:24,o8AJsGjZvAI
Choopey Nee Choopey,Harish Raghavendra,Rakshakudu (Original Motion Picture Soundtrack),122,5:00,EjD6yLzAOYk
"Mayilrage (From ""Ah…Aah"")",Madhusree;Naresh Iyer,Youth Beats - Hits of A.R.Rahman and Yuvan Shankar Raja,122,5:22,Sd0XtHbDytM
Anbe En Anbe,Harris Jayaraj;Harish Raghavendra,Dhaam Dhoom (Original Motion Picture Soundtrack),122,5:04,et0-Mh5UR58
"Kikku Yerudhey (From ""Padayappa"")",A.R. Rahman;Mano;Febi Mani,Padayappa (Original Motion Picture Soundtrack),122,5:26,_bXDWh58MjA
Venilla Venilla,Asha Bhosle,Iruvar (Original Motion Picture Soundtrack),122,4:58,SN6P0j1NPjM
"Putham Puthu Kaalai - From ""Alaigal Oyvatillai""",S. Janaki,"The Golden Melodies - Ilaiyaraaja, Vol. 1",121,4:33,rElxu7BR0Kc
Pallinginal Oru,L. R. Eswari,Vallavan Oruvan (Original Motion Picture Soundtrack),121,3:45,-nrnGjxOLA0
Avam the Theme,Sundaramurthy K.S.,Avam (Original Motion Picture Soundtrack),121,2:18,VyUq9X3V-Vo
Naaku Neeku,Kunal Ganjawala;Vasundhara Das,Aparichitudu (Original Motion Picture Soundtrack),121,5:25,Ncri-1QmSv8
Pookkal Pookkum,G. V. Prakash;Roop Kumar Rathod;Harini;Andrea Jeremiah;Na.Muthukumar,Madharasapattinam (Original Motion Picture Soundtrack),120,6:36,9Wg2rk5AVqQ
Engeyo Paartha,Yuvan Shankar Raja;Udit Narayan;Na.Muthukumar,Yaaradi Nee Mohini (Original Motion Picture Soundtrack),120,5:20,JLWQ_mMGXI0
Koodamela Koodavechi,D. Imman;VV Prassanna;Vandana Srinivasan;Yugabharathi,Rummy (Original Motion Picture Soundtrack),120,5:00,jt3yQ4Sxjk0
Akkam Pakkam,Sadhana Sargam,Kireedam,120,5:16,dCojZqMKKrQ
Adada Mazhaida,Yuvan Shankar Raja;Rahul Nambiar;Saindhavi;Na.Muthukumar,Paiya (Original Motion Picture Soundtrack),120,4:27,k7NfhqqlA0c
Engeyum Kaadhal,Harris Jayaraj;Aalaap Raju;Devan Ekambaram;Ranina Reddy,Engeyum Kadhal (Original Motion Picture Soundtrack),120,5:31,yje_kx6vOB0
Ethir Neechal,Anirudh Ravichander;Yo Yo Honey Singh;Hiphop Tamizha;Vaali,Ethir Neechal (Original Motion Picture Soundtrack),120,4:30,ib8FunNzsg0
Kanaa Kaangiren,G. V. Prakash;Shubha Mudgal;Nithyasree Mahadevan;Vinitra;Vairamuthu,Anandha Thaandavam (Original Motion Picture Soundtrack),120,5:45,hBr0FPjiNA4
Yedho Ondru Ennai,Yuvan Shankar Raja;Na.Muthukumar,Paiya (Original Motion Picture Soundtrack),120,3:33,gyfizhTrLrQ
Oru Naalaikkul,Yuvan Shankar Raja;Karthik;Rita Thyagarajan;Na.Muthukumar,Yaaradi Nee Mohini (Original Motion Picture Soundtrack),120,5:40,zNssTfUMaPA
"Oru Devathai (From ""Vaamanan"")",Yuvan Shankar Raja;Roop Kumar Rathod;Na.Muthukumar,All About Love: Yuvanshankar Raja,120,4:56,bTdDI00LRrs
"Enadhuyire (From ""Bheema"")",Nikkil Mathew;Chinmayi;Sadhana Sargam,Chinmayi Special,120,4:44,HHAYErJVqAw
Mun Paniya,S. P. Balasubrahmanyam;Malgudi Subha;Palani Bharathi,Nandha (Original Motion Picture Soundtrack),120,5:40,JBZFbhTAObA
Kadhalikka,Vijay Antony;Emcee Jezz;Naresh Iyer;Andrea Jeremiah;Sharmila,Vedi (Original Motion Picture Soundtrack),120,4:36,ikfnjJ2SYrc
Neeya Pesiyathu,Shankar Mahadevan;Yugabharathi,Thirumalai (Original Motion Picture Soundtrack),120,4:37,NZ78zKuhhsw
"Shoot the Kuruvi - From ""Jil Jung Juk""","Vishal Chandrashekhar;Anirudh Ravichander;""Datho"" Radha Ravi;Siddharth","Shoot the Kuruvi (From ""Jil Jung Juk"")",120,4:22,0Up0YG0h5Ao
Aye Sinamika,A.R. Rahman;Karthik,O Kadhal Kanmani (Original Motion Picture Soundtrack),120,6:30,AlUjKp2gyxY
Pachchai Vanna,Yuvan Shankar Raja;Madhan Karky,Vai Raja Vai (Original Motion Picture Soundtrack),120,4:15,vzrbuWGnbI4
Ezhu Velaikkara,Anirudh Ravichander;Siddharth Mahadevan,Velaikkaran (Original Motion Picture Soundtrack),120,5:03,kpliqLINAes
Sil Sil Mazhaiye,Sathyan;Chinmayi,Arinthum Ariyamalum (Original Motion Picture Soundtrack),120,3:52,3kVcS4zL3d4
"Aanandha Yaazhai (From ""Thangameenkal"")",Yuvan Shankar Raja;Sriram Parthasarathy,Take 10: Yuvanshankar Raja,120,3:37,k0yPQb08wkU
Adicha Nethiyadi,Vidyasagar;Karthik;Swarnalatha,Villain (Original Motion Picture Soundtrack),120,5:23,YYvou2ZNsrs
Pineapple Vannathodu,Shankar Mahadevan;Sujatha,Samudhram (Original Motion Picture Soundtrack),120,5:12,Cn2xmeM5rmk
Ambala Singam,Sean Roldan;Haricharan,Mundasupatti (Original Motion Picture Soundtrack),120,3:58,w0ageb7Y1rY
Paadatha Pattellam,Sathyaprakash;Nithyashree Venkataramanan,Paadatha Pattellam - Single,120,4:41,wU69Ka6xlc4
Theme of SMS,Hemachandra Vedala,SMS - A Sweet Revenge Story (Original Motion Picture Soundtrack),120,1:35,t4fvVw2sDmY
Manjal Veyil,Hariharan;Nakul;Vijay,Vettaiaadu Vilayadu (Original Motion Picture Soundtrack),120,5:55,1TT7bOxlorw
Unna Vida,Kamal Haasan;Shreya Ghoshal,Virumandi,120,6:25,jQrPdHJQxLo
Ennadi Maayavi Nee,Sid Sriram,VadaChennai (Original Motion Picture Soundtrack),120,4:11,7OOmtSYXW_M
Manjal Veyil,Harris Jayaraj;Hariharan;Vijay;Nakkhul,Vettaiyaadu Vilaiyaadu (Original Motion Picture Soundtrack),120,5:53,1TT7bOxlorw
Nenjukulla Nee,"Vijay Prakash,Diwakar,Ajesh",Vadacurry (Original Motion Picture Soundtrack),120,4:58,rAq0Bnw4RPk
Dandana Darna,Sangeeth halthipur,Kuruvi,120,3:47,J6VxyrUlr7M
Thayin Manikodi,S. P. Balasubrahmanyam,Jai Hind (Original Motion Picture Soundtrack),120,4:39,70HHc7TxAe4
Mukabala Mukabala,Mano;Swarnalatha,Premikudu (Original Motion Picture Soundtrack),120,5:23,HU2IFsxJTPo
Oru Kal,Ab1shanth,Siva Manasula Shakti,120,5:06,AiUzw9S7FmI
Oru Kal (Version 1),Yuvan Shankar Raja,Siva Manasula Sakthi (Original Motion Picture Soundtrack),120,5:06,oPyi9Ci78tQ
Oru Paarvaiyil,Ranjith Govind,Siva Manasula Sakthi (Original Motion Picture Soundtrack),120,1:36,BUkyx8cmeC0
Vethalaiya Potendi,Yuvan Shankar Raja;Pa. Vijay;Shankar Mahadevan,Billa (Original Motion Picture Soundtrack),120,4:22,iqU9C0R6ITw
En Kadhale,A.R. Rahman;S. P. Balasubrahmanyam,Duet (Original Motion Picture Soundtrack),120,6:00,zbMgH5uny1U
Oru Thanga Radhathil,Malaysia Vasudevan,Dharma Yuddham (Original Motion Picture Soundtrack),119,4:26,8dSCb_4sAIQ
"Innum Ennai Enna (From ""Singaravelan"")",S. P. Balasubrahmanyam;S. Janaki,SPB & Janaki Evergreen Duet Songs,119,4:56,HZSc5Q24BPo
Yembuttu Irukkuthu Aasai,D. Imman;Sean Roldan;Kalyani Nair;Yugabharathi,Saravanan Irukka Bayamaen (Original Motion Picture Soundtrack),118,4:30,41LOLZrjmqM
Agayam Theepiditha,Santhosh Narayanan;Pradeep Kumar,Madras (Original Motion Picture Soundtrack),118,3:50,9VFv0ZSFRw8
Adi Rakkamma,Ranjith Govind;Suchitra,Siruthai (Original Motion Picture Soundtrack),118,4:23,97i4c6_ewsg
Endi Ippadi,Santhosh Narayanan,Enakkul Oruvan (Original Motion Picture Soundtrack),118,3:48,1-eMcqdhNG8
"Bujji (From ""Jagame Thandhiram"")",Santhosh Narayanan;Anirudh Ravichander;Vivek,"Bujji (From ""Jagame Thandhiram"")",118,4:27,jjewYOqy13M
Un Kadhal Irundhal Podhum,Leon James;Armaan Malik;Shashaa Tirupati,Kavalai Vendam (Original Motion Picture Soundtrack),118,4:31,0_QssBtipN8
Dhill Dhill,Timmy;Sriram Parthasarathy,Dhill (Original Motion Picture Soundtrack),118,4:08,pxjWSLv2e-Q
Oyaayiye Yaayiye,Benny Dayal;Haricharan;Chinmayi;Saindhavi,Ayan,118,5:35,hDYjPoNtUbI
Ennai Thalatta Varuvala (Duet),Ilaiyaraaja;Palani Bharathi,Kadalukku Mariyadai (Original Motion Picture Soundtrack),117,5:04,GWS1ZUeVE8k
Thalaivaa Thalaivaa,G. V. Prakash;Haricharan;Pooja;Zia Ulhaq,Thalaivaa (Original Motion Picture Soundtrack),117,5:38,CLGVbyPIWag
Ennai Thalatta Varuvala (Language: Tamil; Film: Kadalukku Mariadai; Film Artist 1: Vijay; Film Artist 2: Shalini),Hariharan,Thullatha Manamum Thullum & Kadalakku Mariathai,117,5:04,j2xiISfEKqM
"Ullathai Killade ("" From Tamizhan"")",Vijay;Priyanka Chopra,D. Imman Hits,117,5:03,tfmvBnULtIQ
Annul Maelae,Harris Jayaraj;Sudha Ragunathan;Thamarai,Vaaranam Aayiram (Original Motion Picture Soundtrack),116,5:22,fh6_h3BEWLs
Yaar Indha Saalai Oram,G. V. Prakash;Saindhavi;Na.Muthukumar,Thalaivaa (Original Motion Picture Soundtrack),116,5:15,Yt4xOLzQgrE
"Railin Oligal - From ""Blue Star""",Govind Vasantha;Pradeep Kumar;Shakthisree Gopalan,"Railin Oligal (From ""Blue Star"")",116,2:37,nFOjaKgVCl4
Yennai Arindhaal,Harris Jayaraj;Devan Ekambaram;Mark Thomas;Abhishek,Yennai Arindhaal (Original Motion Picture Soundtrack),116,5:46,eeqZD2ZSwb0
"Yaar Indha Saalai Oram (From ""Thalaivaa"")",G. V. Prakash;Saindhavi;Na.Muthukumar,My Playlist: G.V. Prakash Kumar,116,5:15,hhTj5rtfS7c
Vaan Engum Nee Minna,Harris Jayaraj;Aalaap Raju;Harini;Devan Ekambaram;Pravin Saivi;Madhan Karky,Endrendrum Punnagai (Original Motion Picture Soundtrack),116,4:24,Ism0k7k4pkU
"Naanaga Naanillai Thaye (From ""Thoongathe Thambi Thoongathe"")",S. P. Balasubrahmanyam,SPB - The Voice For A Millennium,116,4:34,_DJT5DRUaOU
Venmegam,Yuvan Shankar Raja;Hariharan;Na.Muthukumar,Yaaradi Nee Mohini (Original Motion Picture Soundtrack),115,4:34,u-OyizDoyFw
Nenjukkul Peidhidum,Harris Jayaraj;Hariharan;Devan Ekambaram;VV Prassanna;Thamarai,Vaaranam Aayiram (Original Motion Picture Soundtrack),115,6:09,M-gKOqiSB2c
Iragai Poley,Yuvan Shankar Raja;Tanvi Shah,Naan Mahaan Alla (Original Motion Picture Soundtrack),115,5:17,RI2VQ8FIFVw
Chill Makkaa,Sean Roldan;Pradeep Kumar,Good Night (Original Motion Picture Soundtrack),115,4:14,4BqnCHAToFk
O Crazy Minnal,Andrea Jeremiah,Naduvula Konjam Pakkatha Kaanom (Original Motion Picture Soundtrack),115,4:26,S63TAy-ddxM
Mayakkuraane,Arrol Corelli;Andrea Jeremiah,Annanukku Jey (Original Motion Picture Soundtrack),115,3:51,loiZ1gA3woI
"Ithu Oru Ponmalai - From ""Nizhalgal""",S. P. Balasubrahmanyam,Ilaiyaraaja Tamil Special,115,4:18,cIy56JR-FD8
Odum Varayil,KK;Bele Shede,Aegan (Original Motion Picture Soundtrack),115,4:26,w9tzqcOianA
Kodambakkam Area,Tippu;Shoba Chandrasekar,Sivakasi,115,5:30,79OMQtCBhaM
Nenje Nenje,Harish Raghavan;Mahathi,Ayan,115,5:44,T5tDmD2U4kI
Ennai Konjum,Timmy;Tippu;Pop Shalini;Thamarai,Kaakha Kaakha (Original Motion Picture Soundtrack),114,5:56,6GxiCS2hrD8
Mudhal Mazhai,Prasanna.R;Hariharan;Mahathi,Bheema (Original Motion Picture Soundtrack),114,5:43,AVGZJHgH7tk
Kaal Mulaitha Poovae,Harris Jayaraj;Javed Ali;Mahalakshmi Iyer;Nincy Vincent;Madhan Karky,Maattrraan (Original Motion Picture Soundtrack),114,5:30,ObyYPrbz-LE
Irumugan Settai,Harris Jayaraj;Kavithai Gundar Emcee Jesz;Steeve Vatz;MALIII,Iru Mugan (Original Motion Picture Soundtrack),114,4:05,_mCJI14R-VY
Kaadhal Oru,Harris Jayaraj;Aalaap Raju;Hemachandra Vedala;Sunitha Sarathy,Oru Kal Oru Kannadi (Original Motion Picture Soundtrack),114,6:07,LM-ICgG09oY
Aanaal,Ilaiyaraaja;Ananya Bhat,Modern Love (Chennai) [Original Series Soundtrack],114,2:18,IL8C3CeabFM
Sundari,S. P. Balasubrahmanyam;S. Janaki,Spb & S Janaki - Tamil Hits Vol-1,114,7:09,ndskelxiODk
Mudhal Mazhai,Harris Jayaraj;Prasanna;Hariharan;Mahathi,Bheema (Original Motion Picture Soundtrack),114,5:43,AVGZJHgH7tk
Thug Le,Salim–Sulaiman;Vishal Dadlani;Shweta Pandit;Amitabh Bhattacharya,Ladies vs Ricky Bahl,113,3:38,zAPSCawQ6CM
June Ponal,Krishh;Arun,Unnale Unnale,113,6:01,1BFgdwrkp7M
Maanguyilae - Solo,S. P. Balasubrahmanyam,Karakattakkaran (Original Motion Picture Soundtrack),113,4:37,_gCGJELNqpQ
Vaa Vaa En Devadhai,Vidyasagar;Madhu Balakrishnan,Abhiyum Naanum (Original Motion Picture Soundtrack),113,4:49,diaZU8gajU4
"Nenjodu (From ""Kadhal Kondaen"")",Unnikrishnan;Sujatha,Hits of Unnikrishnan and Srinivas,113,6:25,u4ij672aR-k
Ennoda Kadhal,Mano;Harini,Panchathanthiram,113,4:48,mTbBQCGBkhw
Unakkul Naane,Harris Jayaraj;Bombay Jayashri,Patchai Kili Muthucharam (Original Motion Picture Soundtrack),113,4:41,_c0brrD96Bc
Pokkiri Theme,Mani Sharma,Pokkiri,113,2:37,J4qeJZy86Ug
Nagada Sang Dhol,Shreya Ghoshal;Osman Mir,Ram-Leela (Original Motion Picture Soundtrack),113,4:33,wTFGQVQCGN8
Oru Maalai,Karthik,Ghajini (Original Motion Picture Soundtrack),112,5:54,7cO_n-T8RjE
"En Anbay (From ""Mounam Pesiyathe"")",Shankar Mahadevan,Hits of Harris Jayaraj & Yuvan Sankar Raja Isai Mayakkam,112,4:46,EQpOiLOm084
Are You Crazy,Devi Sri Prasad;Prabhu Deva,Villu (Original Motion Picture Soundtrack),112,0:46,mGtCyWf_qqg
Nilaave Vaa,S. P. Balasubrahmanyam,Mouna Ragam (Original Motion Picture Soundtrack),112,4:37,K_fN5yysMHg
Yennai Maatrum Kadhale,"Anirudh Ravichander,Sid Sriram",Wunderboy Anirudh,112,4:34,-mg_zzM-6eU
Hyar Ettu,Shankar Mahadevan;Anuradha Sriram,Maja,112,4:38,BVmNSHbwt9s
Yennai Maatrum Kadhale,Sid Sriram,Naanum Rowdy Dhaan (Original Motion Picture Soundtrack),112,4:34,-mg_zzM-6eU
"Oru Maalai - Language: Tamil; Film: Ghajini; Film Artists: Surya, Asin",Karthik,Ghajini,112,5:53,zRHb5U-LouE
Malare,Vidyasagar;S. P. Balasubrahmanyam;S. Janaki;Vairamuthu,Karna (Original Motion Picture Soundtrack),111,5:05,xAHRh6-OOrs
"Inthadi (From ""Dhol"")",Tippu;Rafi;Kalyan,Hits of Vidyasagar,111,4:02,sdu6MBIFtuY
Yethetho (From “Punnagai Mannan”),K. S. Chithra,Malare Mounama,111,4:53,QCmJ5l5jOWA
Idhazhin Oram - The Innocence of Love,Anirudh Ravichander;Ajesh;Aishwarya R Dhanush,3 (Original Motion Picture Soundtrack),110,3:24,lZORMUufA_Y
Nee Paartha Vizhigal - The Touch of Love,Anirudh Ravichander;Vijay Yesudas;Shweta Mohan;Dhanush,3 (Original Motion Picture Soundtrack),110,4:24,_IuJsaMqtqc
Kannazhaga - The Kiss of Love,Anirudh Ravichander;Dhanush;Shruti Haasan,3 (Original Motion Picture Soundtrack),110,3:25,0tX2ck4Rmzk
"Devathaiya Kandein (From ""Kadhal Kondaen"")",Harish Raghavendra,Hits of Harish Ragavendra,110,5:10,v4K1ywf19xw
Enna Solla - The New Life of Tamizh,Anirudh Ravichander;Shweta Mohan;Dhanush,Thangamagan (Original Motion Picture Soundtrack),110,3:36,2P_0Q8CIjw8
Devathaiya Kandein,Harish Raghavendra,Kadhal Kondaen,110,5:10,v4K1ywf19xw
Tak Bak - The Tak Bak of Tamizh,Anirudh Ravichander,Thangamagan (Original Motion Picture Soundtrack),110,2:34,Zl7B70EQeVo
Takkunu Takkunu,Hiphop Tamizha;Anirudh Ravichander,Mr. Local (Original Motion Picture Soundtrack),110,3:32,AHvjmc33WH8
"Enna Solla (From ""Thangamagan"") - The New Life of Tamizh",Anirudh Ravichander;Shweta Mohan;Dhanush,Young Mavericks (Anirudh & Santhosh Narayanan),110,3:35,2P_0Q8CIjw8
Minnalgal Koothadum,Karthik;Bombay Jeyashree,Polladhavan (Orginal Motion Picture Soundtrack),110,6:49,xs-PmrCe8Xk
"Kannazhaga (From ""3 [Tamil]"") - The Kiss of Love",Anirudh Ravichander;Dhanush;Shruti Haasan,Playback: Madras Melodies - Soulful Tamil Melodies,110,3:25,
Ela Machi Machi,Vidyasagar;Kamal Haasan;Udit Narayan,Anbe Sivam (Original Motion Picture Soundtrack),110,4:34,ZU3lqIzq3xQ
Sevvanam Selaikatti,Jassie Gift,Mozhi (Original Motion Picture Soundtrack),110,4:43,56MHvLWJgVU
"Eno Kangal (From ""Kalvanin Kadhali"")",Yuvan Shankar Raja;Na.Muthukumar;Sadhana Sargam,Kalvanin Kadhali (Original Motion Picture Soundtrack),110,5:30,Z5D3flwCfg0
Arugil,Harris Jayaraj;Hariharan;Tanvi Shah,Dhruva Natchathiram (Original Motion Picture Soundtrack),110,3:58,TxQhX0N0oac
Sandhipoma,A.R. Rahman;Unni Menon;Chandralekha Annupamaa,Enakku 20 Unakku 18,110,5:36,g8rgxoWlTx0
Neethane,Yuvan Shankar Raja,Sarvam,110,5:13,-7WOJBEcPMo
Kaaki Sattai,Anirudh Ravichander;Vishal Dadlani,Kaaki Sattai (Original Motion Picture Soundtrack),110,3:43,GTkFaoQuKvY
Smiling with the Pain (The Yearning of Raghuvaran),Anirudh Ravichander,Velai Illa Pattadhaari,110,1:29,v355hibeb1I
Kaaki Sattai Theme Music,Anirudh Ravichander,Kaaki Sattai (Original Motion Picture Soundtrack),110,0:47,xDyJSnA4q-k
Hey Sala,Blaze;Naresh Iyer;Md Aslam,Aegan (Original Motion Picture Soundtrack),110,5:04,alDTr4xsl6o
Endrendrum Punnagai,Srinivas;Clinton;Praveen;Shankar,Alaipayuthey (Original Motion Picture Soundtrack),110,3:58,bIRe8UWT9cI
Dhol bhaje,KK;Shweta Mohan,Deepavali (Original Motion Picture Soundtrack),110,4:26,NlT72OYQuSs
Adhareeni,A.R. Rahman;Sayonara,Sivaji,110,5:44,GA3fYj3ECsw
Needhane,Yuvan Shankar Raja;Pa. Vijay,Sarvam (Original Motion Picture Soundtrack),110,5:12,Ofe_6YuoSwc
Vizhigalil Oru Vaanavil,G. V. Prakash;Saindhavi,Deiva Thiirumagal (Original Motion Picture Soundtrack),109,6:02,-z3_uhdqybI
Varayo En Thozhi,Sonu Nigam;Harini;Vairamuthu,Jeans (Original Motion Picture Soundtrack),109,5:48,QNjCPC0VAf4
Madurai Veeran,Vidyasagar;Paravai Muniyamma,Dhool (Original Motion Picture Soundtrack),109,3:21,eauJy3zTOT8
Kanmaniyae Kadhal Enbathu,S. P. Balasubrahmanyam;S. Janaki,Duets of Yesterdays & Todays,109,4:23,KMVSNHl03UY
Kanne Kannin Maniye,P. Susheela,Nenjangal (Original Motion Picture Soundtrack),109,6:12,bEJd7o2sq8s
Yae Paadal Ondru,S. Janaki;K. J. Yesudas,Ilaiyaraaja - The Passion Of The Early Years,109,4:41,E0_A1dGNKr8
Azhagho Azhaghu,Yuvan Shankar Raja;Naresh Iyer,Samar (Original Motion Picture Soundtrack),108,4:50,Dr_1s3mwOgc
Vilambara Idaiveli,Hiphop Tamizha;Srinisha Jayaseelan;Sudarshan Ashok;Christopher Stanley,Imaikkaa Nodigal (Original Motion Picture Soundtrack),108,4:33,K_VEjmk_Tmg
Paartha Mudhal,Unni Menon;Bombay Jayashri,Vettaiaadu Vilayadu (Original Motion Picture Soundtrack),108,6:08,J2gvpc0zo0M
Chennai Sentamizh,Srikanth Deva;Harish Raghavendra,M. Kumaran Son Of Mahalakshmi,108,4:17,0azhRxCIhrU
Paartha Mudhal,Harris Jayaraj;Unni Menon;Bombay Jayashri,Vettaiyaadu Vilaiyaadu (Original Motion Picture Soundtrack),108,6:06,J2gvpc0zo0M
Pulveli Pulveli (Female),K. S. Chithra;P. Unni Krishnan,Aasai,108,6:26,S9f13Cw2t0M
Minsaram En Meedhu,Harish Raghavendra;Sadhana Sargam,Run,108,4:56,thIYoKZLdew
,,Kolamavu Kokila,108,,b68HETiNO98
Unakkul Naane,Harris Jayaraj;Rohini;Pritt;dilushselva,Unakkul Naane,107,2:07,_c0brrD96Bc
Yeno Yeno Panithuli,Harris Jayaraj;Shail Hada;Sudha Ragunathan;Andrea Jeremiah;Thamarai,Aadhavan (Original Motion Picture Soundtrack),107,5:12,x4sFf1arFv4
Lolita,Harris Jayaraj;Karthik;Prashanthini;Thamarai,Engeyum Kadhal (Original Motion Picture Soundtrack),107,5:10,h_YBZGaPl8M
Ada Gada Gada,Harris Jayaraj;Premgi Amaren,Sathyam,107,5:01,7mII9TVWKuU
"Aaraadhike - From ""Ambili""",Vishnu Vijay;Sooraj Santhosh;Madhuvanthi Narayan;Vinayak Sasikumar,"Aaraadhike (From ""Ambili"")",106,6:00,dAezp422I_A
Oh My Love,S. P. Balasubrahmanyam,Idhaya Thaamarai (Original Motion Picture Soundtrack),106,4:43,MUpVH7V9jqA
On Nanbane,Tippu;Karthik;K. S. Chithra,Dhill (Original Motion Picture Soundtrack),106,5:25,AO-SGSzuAyc
Yathe Yathe,G. V. Prakash;Snehan,Aadukalam (Original Motion Picture Soundtrack),105,5:44,R9aHcmKEY8s
Kangal Irandal,James Vasanthan;Bellie Raj;Deepa Miriam;Thamarai,Subramaniapuram (Original Motion Picture Soundtrack),105,5:22,50Cy1YKg3RI
En Kadhal Solla,Yuvan Shankar Raja;Tanvi Shah;Na.Muthukumar,Paiya (Original Motion Picture Soundtrack),105,4:53,Ug9Th4kO8tM
Neduvaali,Thaman S;Rahul Nambiar;Mahathi;Yugabharathi,Osthe (Original Motion Picture Soundtrack),105,4:22,wBmI4Nly4N8
Hey Rosu Rosu,Mani Sharma;Ranjith Govind;Jaey,Padikkathavan (Original Motion Picture Soundtrack),105,4:53,195YLBjhTHs
"Enthaaraa Enthaaraa - From ""Thirumanam Ennum Nikkah""",Shadab Faridi;Chinmayi,I Love Ghibran,105,4:39,h1BGDHumhj4
Kathal Website Ondru,Yuvan Shankar Raja;Vaali;Shankar Mahadevan;Harini;Timmy,Dheena (Original Motion Picture Soundtrack),105,5:34,TIPKzW3h_vQ
Saachitale,Yuvan Shankar Raja,Love Today (Original Motion Picture Soundtrack),105,3:58,18PCf6aq5wI
