Track Name,Artist,Album,Tempo,Duration,Video ID
Karupputhan Yenakku,Deva;Anuradha Sriram,Vetri Kodi Kattu (Original Motion Picture Soundtrack),105,5:51,AJLx_As6ETE
Kadhal Oru,KK,Shajahaan,105,5:22,rNihy4L8DXI
Vaadi Vaadi Naattu Katta,Vidyasagar;Shankar Mahadevan;Sujatha,Alli Thantha Vaanam (Original Background Score),105,4:25,RAyIVDmVez4
Mama Douser,Andrea Jeremiah,Soodhu Kavvum (Original Motion Picture Soundtrack),105,3:20,J3Z2LWkF_s4
"Maalai Pozhuthin (From ""Bhagyalakshmi"")",P. Susheela,Enchanting Voice of South Cinema - P. Susheela,105,4:34,yH7fxlst3zI
Kadhal Yaanai,Harris Jayaraj;Shankar Mahadevan;Harini,Anniyan (Original Motion Picture Soundtrack),105,5:45,XchnFp8KAK4
Mutham Mutham,KK;Mahalakshmi Iyer,12 B (Original Motion Picture Soundtrack),105,5:02,GvayoorAun4
Chinna Thamarai,Vijay Antony;Krishh;Suchitra;Viveka,Vettaikaaran (Original Motion Picture Soundtrack),104,4:33,7lWzL_VBano
Poovukkul,Unnikrishnan;Sujatha;Vairamuthu,Jeans (Original Motion Picture Soundtrack),104,6:53,QmeNUVWir-k
Snehidhane,Sadhana Sargam;Srinivas,Alaipayuthey,104,4:53,5A7dz_T7QWA
"Kaadhal kaditham (From ""Jodi"")",Unni Menon;S. Janaki,Hits of A.R.Rahman Isai Saral,104,4:57,8gWstqAJOdc
Aila Aila,A.R. Rahman;Aditya Rao;Natalie Ram;Madhan Karky,I (Original Motion Picture Soundtrack),104,5:34,_a-t7bZYqGg
Vaan Nila,A.R. Rahman;Srinivas;Karthik,Kaadhal Virus (Original Motion Picture Soundtrack),104,6:02,v7nUHnhKqmU
Vaarayo Vaarayo,Harris Jayaraj;Chinmayi;Unnikrishnan;Mega;Kabilan,Aadhavan (Original Motion Picture Soundtrack),103,5:16,O_ZEFugiGAw
Mudher Kanave,Bombay Jayashri;Harish Raghavendra;O.S. Arun;Vairamuthu,Majunu (Original Motion Picture Soundtrack),103,5:10,CuHnHsVostg
Thalattum Katre Vaa,Shankar Mahadevan;Vairamuthu,Poovellam Unn Vaasam (Original Motion Picture Soundtrack),103,6:13,UtWKVrjVirU
Step It Up,Benny;Megha,Kavalan (Original Motion Picture Soundtrack),103,4:34,_xnYyomdbxY
Ellorum Sollum Paattu,S. P. Balasubrahmanyam,Marupadiyum (Original Motion Picture Soundtrack),103,4:50,t2erZNRkVdQ
Adadaa Adadaa Adadaa,Sidharth,Santhosh Subramaniyam,103,4:04,vg6fuN0oO2Y
Poopol Poopol - Instrumental,Tippu;Karthik,Minnale (Original Motion Picture Soundtrack),103,1:56,HTpJXEM-nmM
Bhoochadae,Rahul Nambiar;Naveen Madhav;Shreya Ghoshal;Ramya,Race Gurram,103,4:21,icezXhjlSKQ
Vaanganna Vanakkanganna,G. V. Prakash;Vijay;Santhanam;Na.Muthukumar,Thalaivaa (Original Motion Picture Soundtrack),102,5:33,9hotns0Pgt0
Venpanju,Vidyasagar;Udit Narayan;Karthik,Kanden Kadhalai (Original Motion Picture Soundtrack),102,4:54,UpMkCZ9mmfY
Oh Penne - International Version,Anirudh Ravichander;Arjun;Charles Bosco,Vanakkam Chennai (Original Motion Picture Soundtrack),102,3:33,7EH-V_3t2M0
Sangeetha Jathimullai,Ilaiyaraaja;S. P. Balasubrahmanyam,Kaadhal Oviyam (Original Motion Picture Soundtrack),102,6:53,2LEFgK4p8bQ
Thappu Thandaa!,Vidyasagar;Shankar Mahadevan;Sujatha,Villain (Original Motion Picture Soundtrack),102,4:44,nY1sHrxz5dk
Mayakkum Maalai,A. M. Rajah;Jikki,A. M. Rajah Hits,102,3:45,dzhcX3KPe1c
Kabadi,Vidyasagar;Jayamoorthy;Maran,Ghilli,102,1:44,JS3Q4-aEo-A
"Oho Enthan Baby, Pt. 2",A. M. Rajah;S. Janaki,Then Nilavu (Original Motion Picture Soundtrack),102,3:56,vCnGatVR25A
Kaadhal Vanthirichu,Silambarasan TR,Vallavan (Original Motion Picture Soundtrack),102,4:21,AKjj5GfCuxk
Tamizhanda,Hiphop Tamizha,Hip Hop Tamizhan,102,3:07,JoRdMNKFPv4
Nallai Allai,A.R. Rahman;Chinmayi;Sathyaprakash;Vairamuthu,Kaatru Veliyidai (Original Motion Picture Soundtrack),101,3:59,Ixiq9ysnqos
Unnaale Unnaale,Karthik;Krishh;Harini,Unnale Unnale,101,4:43,DQ94bhlIJcU
Achcho,Udit Narayan;Kavita Krishnamurthy,Shajahaan,101,4:28,F9zD8q6ecUo
Sundari Kannal,Noel Toms,Sundari Kannal,101,2:35,6oCJQF1JE3k
Ayiram Nilave Vaa,S. P. Balasubrahmanyam;P. Susheela,Adimai Penn,101,6:02,GyonGeOEI3E
Poongathave Thaal,Deepan Chakarvarthy;Uma Ramanan;Gangai Amaran,Nizhalgal (Original Motion Picture Soundtrack),101,4:20,KLuOUSmocDE
Showkali,A.R. Rahman;Aditya Rao;Aaryan Dinesh Kanagaratnam;Sri Rascol,Achcham Yenbadhu Madamaiyada (Original Motion Picture Soundtrack),101,4:38,uJK1yuC9qhk
Unnaale Unnaale,Karthik;Krishh;Harini,Unnaale Unnaale (Original Motion Picture Soundtrack),101,4:43,DQ94bhlIJcU
Aval,Santhosh Narayanan;Pradeep Kumar;Priya Hemesh;Vivek,Manithan (Original Motion Picture Soundtrack),100,4:26,qT4aMYKjYto
JD Intro - Background Score,Anirudh Ravichander,Master (Original Background Score),100,1:20,J25jHfjGa_A
Thaaliyae Thevaiyillai,Hariharan;Bhavatharini,Yuvans Yorker Hits,100,4:47,p7VtujhpB_Q
Vaathi Raid,Anirudh Ravichander;Arivu,Master (Original Motion Picture Soundtrack),100,3:29,McTvummBHt0
Azhagiye,A.R. Rahman;Arjun Chandy;Haricharan;Jonita Gandhi;Madhan Karky,Kaatru Veliyidai (Original Motion Picture Soundtrack),100,3:44,uLLDYV6j40k
Kadhal Kappal,Santhosh Narayanan;Muthamil,Iraivi (Original Motion Picture Soundtrack),100,4:03,9-J8iKVH6jQ
Mazhaiye Mazhaiye,Thaman S;Ranjith Govind;Viveka,Eeram (Original Motion Picture Soundtrack),100,4:09,eNNpw3_5X7E
Ottraikkannale,Yuvan Shankar Raja;Haricharan;Suchitra,Vel (Original Motion Picture Soundtrack),100,4:04,hwLu87rWMH8
Kan Rendum,M.S.Jones Rupert;G. V. Prakash;Saindhavi,Poriyaalan (Original Motion Picture Soundtrack),100,2:54,XjJK1XUokbQ
Thathi Thathi,Ranjith Govind,Kadhal Kondaen,100,2:47,_9AFWQBx_sc
"Azhagiye (From ""Kaatru Veliyidai"")",A.R. Rahman;Arjun Chandy;Haricharan;Jonita Gandhi;Madhan Karky,Rahman Rewind: Romance,100,3:44,It2wAAi6SvA
Oorellaam Unnai Kandu,Harris Jayaraj;Unnikrishnan;Bombay Jayashri,Nannbenda (Original Motion Picture Soundtrack),100,4:56,CiaLjMhJ61o
Maruvaarthai - Restrung Version,Darbuka Siva;Sid Sriram,Enai Noki Paayum Thota (Original Motion Picture Soundtrack),100,5:01,2RWwDQ-Obqc
Cute Ponnu,Anirudh Ravichander;Vivek Siva,"Cute Ponnu (From ""Enna Solla Pogirai"")",100,4:35,5jfmwMoTobk
"Kanaa Kaanum (From ""7/G Rainbow Colony"")",Harish Raghavendra;Madhumathi,Hits of Unnikrishnan and Harish Ragavendra,100,5:29,GnY6NJ0IE30
"Naan Konjam Karuppu Thaan (From ""Kaththi Sandai"")",Hiphop Tamizha,"Naan Konjam Karuppu Thaan (From ""Kaththi Sandai"")",100,4:36,nX152dXaxHQ
Sha La Laa,Vidyasagar;Sunidhi Chauhan;Pa. Vijay;Yugabharathi,Ghilli (Original Motion Picture Soundtrack),100,4:30,
Poga Poga,Haricharan;Saindhavi;Pa. Vijay,Pattiyal (Original Motion Picture Soundtrack),100,4:42,IQfL6Su9RSg
Angry Bird,Yuvan Shankar Raja;Jithin Raj,Irumbuthirai (Original Motion Picture Soundtrack),100,2:05,9MaTokx3xKw
En Jannalil Therivadhu,Karthik,Mozhi (Original Motion Picture Soundtrack),100,0:56,azLbPAPWzBU
Kovai Gethu,Hiphop Tamizha,Kovai Gethu - Single,100,2:57,aZKz_wTFrSg
Thaaliyae Thevaiyillai,Hariharan;Bhavatharini;Hari,Thaamirabharani (Original Motion Picture Soundtrack),100,4:47,p7VtujhpB_Q
"Un Vizhigalil (From ""Darling"")",Harini,Darling (Original Motion Picture Soundtrack),100,5:04,Zi5sLiLlXCk
Rasaali,A.R. Rahman;Sathyaprakash;Shashaa Tirupati,Achcham Yenbadhu Madamaiyada (Original Motion Picture Soundtrack),100,5:38,Yc3c3sU-vDk
Uyire Uyire,Hariharan;K. S. Chithra,Bombay,100,7:14,f57W1HuHWPk
Poo Pookum Oosai,Sujatha;Malaysia Vasudevan;A.R. Rahman,Minsara Kanavu (Original Motion Picture Soundtrack),100,6:44,pXqdAaMi6VY
"Kangal Neeye (From ""Muppozhudhum Un Karpanaigal"")",G. V. Prakash;Sithara Krishnakumar,Muppozhudhum Un Karpanaigal (Original Motion Picture Soundtrack),100,5:40,sm9Jl9AKRas
Varaaha Nathi,Shankar Mahadevan,Sangamam,100,6:17,OiqEYn1tvFU
Kaadhal Vaithu,Yuvan Shankar Raja;Vijay Yesudas,Deepavali (Original Motion Picture Soundtrack),100,5:09,kROB184hbsA
Idhuthaanaa,Harris Jayaraj;K. S. Chithra,Saamy (Original Motion Picture Soundtrack),100,5:19,nSzZk4-Akww
Idhuthaanaa,Harris Jayaraj;Thamarai;K. S. Chithra,Saamy (Original Motion Picture Soundtrack),100,5:19,nSzZk4-Akww
Arjunar Villu,Vidyasagar;Sukhwinder Singh,Ghilli,100,4:27,JIc0b7fToA8
"Vanthal Maghalakshmiye (From ""Uyarndha Ullam"")",S. P. Balasubrahmanyam,SPB - The Voice For A Millennium,100,4:31,QL17_yQOnao
Kaadhal Vaithu,Vijay Yesudas,Deepavali (Original Motion Picture Soundtrack),100,5:09,kROB184hbsA
Shake That,Anirudh Ravichander;Brodha V,Kaaki Sattai (Original Motion Picture Soundtrack),100,3:03,vjPU2HGbRcU
Thangamey,Anirudh Ravichander,Thangamey (From Naanum Rowdy Dhaan) (Single),100,4:22,2e8PmS2HPeg
Thakida Thakida,Saicharan Bhaskaruni;Santhosh Narayanan,Kaashmora (Original Motion Picture Soundtrack),100,3:49,XmjlPA_BZQA
When Love Rises With Emotion,Yuvan Shankar Raja,Siva Manasula Sakthi (Original Soundtrack),100,2:03,uDeK50TwnYg
Asku Laska,Vijay Prakash;Chinmayi;SUVI,Nanban (Original Motion Picture Soundtrack),99,6:20,p7-q2P5uZzs
"Minsara Poove (From ""Padayappa"")",A.R. Rahman;Srinivas;Nithyasree Mahadevan;Palakkad Sriram;Hariharan;Vairamuthu,Modern Classical Beats Of A R Rahman (Original Motion Picture Soundtrack),99,6:19,p3F1xmFHDlc
Neeye Neeye naane,KK,M.Kumaran Son of Mahalakshmi (Original Motion Picture Soundtrack),99,6:24,4sRjmv8z7FU
Neeye Neeye II,Srikanth Deva,M. Kumaran S/O Mahalakshmi (Original Motion Picture Soundtrack),99,6:22,8qGGhDiqDVY
Yaaro En Nenjai,Devi Sri Prasad;Sagar;Sumangaly;Thamarai,Kutty (Original Motion Picture Soundtrack),98,5:08,wHn2njfQCuA
"Madhu Pole (From ""Dear Comrade"")",Sid Sriram;Aishwarya Ravichandran;Justin Prabhakaran;Joe Paul,"Madhu Pole (From ""Dear Comrade"")",98,4:21,lsUVfha7IOQ
Verenna (Ivan Yaro),Unnikrishnan;Harini,Minnalae (Original Motion Picture Soundtrack),98,5:24,NivQ_dJVkbk
Injarango,Kamal Haasan;K. S. Chithra;Clinton Cerejo;Dominique Cerejo,Thenali,98,6:15,7iF3cY-t1HU
Ilamai Ullaasam,Krishh;Pop Shalini;Pa. Vijay,Unnale Unnale (Original Motion Picture Soundtrack),98,2:10,HEbrwTZb3n0
Thalli Pogathey,A.R. Rahman;Sid Sriram;Aaryan Dinesh Kanagaratnam,Achcham Yenbadhu Madamaiyada (Original Motion Picture Soundtrack),98,4:28,JPOfr0NBDDA
Thalli Pogathey,"A.R.Rahman,Sid Sriram,Aaryan Dinesh Kanagaratnam",Thalli Pogathey (From Achcham Yenbadhu Madamaiyada) - Single,98,4:28,JPOfr0NBDDA
Suttum Vizhi,Sriram Parthasarathy;Bombay Jayashri,Ghajini (Original Motion Picture Soundtrack),97,5:18,0VBDXF-nQEk
Kannuodu Kaanbadhalam,Nithyasree;Vairamuthu,Jeans (Original Motion Picture Soundtrack),97,5:09,QCBRrOKsiH8
Bhavani Theme - Background Score,Anirudh Ravichander,Master (Original Background Score),97,1:20,gxtgw0ApLmg
Yaaradu,Karthik;Suchithra,Kavalan (Original Motion Picture Soundtrack),97,4:25,zOZZGPM2UOE
Oru Vetkam Varudhe,James Vasanthan;Naresh Iyer;Shreya Ghoshal,Pasanga (Original Motion Picture Soundtrack),97,5:57,Sb33V-Zjx7c
Bae,Anirudh Ravichander;Adithya RK;Vignesh Shivan,Don (Original Motion Picture Soundtrack),97,4:02,w7Fjxf62t8E
Poo Malayil,P. Susheela;T. M. Soundararajan,Ooty Varai Uravu,97,3:42,-WP63gkLLO8
"Enthan Uyir (From ""Winner"")",Udit Narayan,Valentine's Day Special 2015,97,4:43,m3wMORMr1qk
Oru Naal Pothuma,Dr. M. Balamuralikrishna,Thiruvilaiyadal (Original Motion Picture Soundtrack),97,5:44,gnYELsuigqM
Thaen Thaen,Udit Narayan;Shreya Ghoshal,Kuruvi,97,3:58,-pTaqX8CIpE
"Ennavale Adi Ennavale (From ""Kaadhalan"")",Unnikrishnan,P. Unnikrishnan Birthday Special Hit Songs 2019,97,5:12,rZvhOxBWb0E
Nee Kaatru Naan Maram,Vidyasagar;Hariharan;K. S. Chithra,Nilaave Vaa (Original Motion Picture Soundtrack),97,5:10,IYTmFk6V2H4
Pudu Maappilaikku,S. P. Balasubrahmanyam;S. P. Sailaja,Apoorva Sagotharargal (Original Motion Picture Soundtrack),97,4:30,mj57IDyPo5k
"Engey Irunthai - Language:Tamil; Film:Thenavattu; Film Artiest:Jeeva , Poonam pajwa",Harish Raghavendra,Thenavattu,97,5:08,GerJia9XWvw
Chiku Buku Raile,Suresh Peters;Mst.G.V.Prakash Kumar,Gentleman,97,5:20,UO0w6S8sgo0
Enga Yeriya,Yuvan Shankar Raja;Dhanush;Premgi Amaren,Pudhupettai (Original Motion Picture Soundtrack),97,5:19,XendNtBdFGA
Thee Illai,Harris Jayaraj;Naresh Iyer;Mukesh;Gopal Rao;Mahathi;Ranina Reddy;Vaali,Engeyum Kadhal (Original Motion Picture Soundtrack),96,5:28,x_tkMp4Q4_Y
Pattambuchi,KK;Rita Thyagarajan,Kavalan (Original Motion Picture Soundtrack),96,3:48,b_B9wovndjE
Kaatrai Konjam,Ilaiyaraaja;Karthik,Neethaane En Ponvasantham (Original Motion Picture Soundtrack),96,5:34,BUr2eNYcrAw
Pachchaikkili,T. M. Soundararajan;P. Susheela,Ulagam Sutrum Valiban,96,5:36,u5qmm4O6bNA
Rathina Katti,Santhosh Narayanan;Dhee,Meyaadha Maan (Original Motion Picture Soundtrack),96,3:48,jiZF0pvS404
Bharathi Kannamma,S. P. Balasubrahmanyam;Vani Jairam,Ninaithale Inikkum (Original Motion Picture Soundtrack),96,5:20,3elj0Sk3q1E
Hold Me Now,Yuvan Shankar Raja;Sanjith Hegde;Thurga,Pyaar Prema Kaadhal (Original Motion Picture Soundtrack),96,3:23,Y0gF-KP7WJE
Kanave Kanave,Anirudh Ravichander,David,95,4:44,qD53-RZpTOc
Oh Penne,Anirudh Ravichander;Vishal Dadlani;Na.Muthukumar,Vanakkam Chennai (Original Motion Picture Soundtrack),95,4:36,J6H6JQHvFMQ
"Hayyoda (From ""Jawan"")",Anirudh Ravichander;Priya Mali,"Hayyoda (From ""Jawan"")",95,3:20,8eYG5QGZAZs
Azhagooril,S. P. Balasubrahmanyam;Sujatha;Arivumathi,Thirumalai (Original Motion Picture Soundtrack),95,4:32,1D5o1tuq0yI
"Usure - From ""Sivappu Manjal Pachai""",Siddhu Kumar;Sudharshan Ashok;Jothi Pushpa,"Usure (From ""Sivappu Manjal Pachai"")",95,3:40,27U4UPhHqjE
Kaathalae Kaathalae - Version 1,Govind Vasantha;Chinmayi,96 (Original Motion Picture Soundtrack),95,3:13,lkPI-45gxBw
Un Paarvayil,Anirudh Ravichander;Vivek Siva,Ethir Neechal (Original Motion Picture Soundtrack),95,1:41,8qv7DUfiqUQ
Mustafaa Mustafaa,A.R. Rahman,Kadhal Desam,95,6:06,aH2VAnvUaaU
Mazhai Varum - Female,Joshua Sridhar;Suzanne D'Mello,Veppam (Original Motion Picture Soundtrack),95,4:28,6xGyu3_JoMw
Mainave Mainave,Unnikrishnan;Sadhana Sargam,Thithikkuthdhe (Original Motion Picture Soundtrack),95,4:49,wujQCerYaXo
Kanmani Anbodu Kadhalan by Madras Music Factory,Aswath Ajith;Madras Music Factory,Kanmani Anbodu Kadhalan,95,3:32,q6jJn1D3lZc
Angel Vandhaaley,Devi Sri Prasad;K. S. Chithra;Palani Bharathi,Badhri (Original Motion Picture Soundtrack),95,4:46,yeLZTLsBI40
"Naakka Mukka (From ""Kadhalil Vizhundhen"")",Vijay Antony,Naakka Mukka - Best Beat Songs,95,5:03,zMs-VMzDCtE
Enakkoru Kadhali,M. S. Viswanathan;S. P. Balasubrahmanyam,Muthana Muthallavo (Original Motion Picture Soundtrack),95,6:05,2_TwSypjxqM
"Nila Kaaigiradhu (From ""Indira"")",Hariharan,Birthday Special A.R. Rahman Tamil Hits,95,4:15,9AobTK9loA0
Kannmoodi thirakkum,Devi Sri Prasad,Sachien,95,5:39,DPo2wWKWU5k
Andha Arabi Kadaloram,A.R. Rahman;Suresh Peters;Swarnalatha,Bombay,95,5:12,oSNVXnDlM4c
Panikkatre,Balram;Sadhana Sargam,Run,95,4:38,nW8IUr9NQcc
Orae Manam,Hariharan;Chandana Bala,Villain (Original Motion Picture Soundtrack),95,4:45,sTSjydD9rhA
"Thottu Thottu Pesum (From ""Edhirum Pudhirum"")",Vidyasagar;Pushpavanam Kuppusamy;Swarnalatha,Edhirum Pudhirum (Original Motion Picture Soundtrack),95,4:44,ZI05Uh7Z68A
Ey Inga Paaru (The Comedian Inside Raghuvaran),Anirudh Ravichander,Velai Illa Pattadhaari,95,1:57,svHICCAeZ9I
Kanmoodi,Devi Sri Prasad,Sachien (Original Motion Picture Soundtrack),95,5:41,9UiTj9c3H54
Ayyo ayyo Unkangal,Udit Narayan;Shalini Singh,M.Kumaran Son of Mahalakshmi (Original Motion Picture Soundtrack),95,5:50,xQZL1Yp3hHw
,,,95,,H0UDxfrKZY4
Oru Ponnu Onnu,Hariharan;Anuradha Sriram;Vairamuthu,Kushi (Original Motion Picture Soundtrack),94,5:36,I_k6H2kEuio
Yuktha Mookhi,Devan Ekambaram;Clinton;Vairamuthu,Poovellam Unn Vaasam (Original Motion Picture Soundtrack),94,5:36,clvUckgQFkw
Varavu Ettana,T. M. Soundararajan;P. Susheela;L. R. Eswari,Bama Vijayam,94,5:35,QdGyXTrJqmE
Sangeetha Megam,S. P. Balasubrahmanyam,Udaya Geetham (Original Motion Picture Soundtrack),94,4:29,tlvMFB4RWXo
En Vaanilay,Jency,Jhonny (Original Motion Picture Soundtrack),94,4:48,q9e9UMJiImI
Theme Music,Pravin Mani;Dr. Bharan;SUVI;Ranina Reddy,Kuruvi (Original Motion Picture Soundtrack),94,3:34,9WumRrmHXI8
Urvashi Uravashi,A.R. Rahman;Suresh Peters;Shahul Hameed,Kaadhalan,94,5:40,77gsdcAXf04
Azhagiya Soodana Poovey,Vijaynarain;Dharshana Kt,Bairavaa,94,4:40,5e0s0zm57r4
Usure Pogudhey,A.R. Rahman;Karthik;Vairamuthu,Raavanan (Original Motion Picture Soundtrack),93,6:06,Xy6oBDZMyig
Badass,Anirudh Ravichander;Vishnu Edavan,Leo (Original Motion Picture Soundtrack),93,3:49,zzgUZt5scbY
Dhimu Dhimu,Harris Jayaraj;Karthik;Na.Muthukumar,Engeyum Kadhal (Original Motion Picture Soundtrack),93,5:29,e6zzo68QQYk
Anbay,S. P. Balasubrahmanyam;O.S. Arun;Rafee,Kadhal Desam,93,5:41,KxjiPgpVkqc
Kannai Vittu,Harris Jayaraj;Tippu;Pravin Saivi;Srimathumitha;Madhan Karky,Iru Mugan (Original Motion Picture Soundtrack),93,6:02,Q77bCBJ8Nvg
Vannam Konda,S. P. Balasubrahmanyam;S. P. Sailaja,Sigaram (Original Motion Picture Soundtrack),93,5:05,qvNWTfvC1l8
Kanaa Kandenadi,Madhu Balakrishnan,Parthipan Kanavu,93,4:45,yf0tkY30-ps
Paruvame,S. P. Balasubrahmanyam;S. Janaki,Hits Of Ilaiyaraaja Vol. 1,93,4:10,rejlq5WO1AM
"Andhi Mazhai Pozhikaruthu (From ""Raaja Paarvai"")",S. P. Balasubrahmanyam;S. Janaki,Sangeetha Saagaram - Spb,93,4:35,sL8jk3olC1Q
Athikkai Kaai,T. M. Soundararajan;P. B. Sreenivas;P. Susheela;Jamuna Rani,Bale Pandiya,93,4:31,bvzW4cnVGBg
Yennadi Meenakshi,S. P. Balasubrahmanyam,Elamai Oonjalaadugiradhu (Original Motion Picture Soundtrack),93,4:06,Hyf4_C_EuLk
Vaa vaa anbe,Ilaiyaraaja,"Wings, Vol. 1",93,4:37,mn9t5mzITcM
Poove Vai Pesum Pothu,Harris Jayaraj;Harish Raghavendra;Mahalakshmi Iyer,12 B,93,5:48,1csxHsOSeEY
Kokkara Kokkarakko,Vidyasagar;Udit Narayan;Sujatha,Ghilli (Original Motion Picture Soundtrack),93,4:36,6JJmg7ph47g
Raa Raa,Binni Krishnakumar;Tippu,Chandramukhi,93,5:26,chTHQhIwxu0
Melliname,Harish Raghavendra,Shajahaan,92,5:26,I8nt30M15Ds
Thuli Thuli,Yuvan Shankar Raja;Haricharan;Tanvi Shah;Na.Muthukumar,Paiya (Original Motion Picture Soundtrack),92,4:43,hRBuP5G3FNM
Nan pogiren,James Vasanthan;S. P. Balasubrahmanyam;K. S. Chithra;Thamarai,Naanayam (Original Motion Picture Soundtrack),92,6:32,fqAljCTdFyA
Irupathu Kodi - Language: Tamil; Film: Thullatha Manamum Thullum; Film Artist 1: Vijay; Film Artist 2: Simran,Hariharan,Thullatha Manamum Thullum & Nee Varuvai Ena,92,5:04,43vsPUEdx_M
"Thuli Thuli (From ""Paiya"")",Yuvan Shankar Raja;Haricharan;Tanvi Shah;Na.Muthukumar,MasterWorks - Yuvanshankar Raja,92,4:43,JrkeEoF70sg
"Thuli Thuli (From ""Paiya"")",Yuvan Shankar Raja;Haricharan;Tanvi Shah;Na.Muthukumar,All About Love: Yuvanshankar Raja,92,4:43,JrkeEoF70sg
Ennai Saaithaalae,Harris Jayaraj;Hariharan;Shreya Ghoshal,Endrendrum Punnagai (Original Motion Picture Soundtrack),92,5:29,fQO-DXzcSgg
Neela Vaanam,Priya Hemesh;Kamal Haasan,Manmadan Ambu (Original Motion Picture Soundtrack),92,4:27,THzPkhXYLd4
"Chinna Chinnathai (From ""Mounam Pesiyathe"")",Hariharan;Yuvan Shankar Raja,Hits of Harris Jayaraj & Yuvan Sankar Raja Isai Thendral,92,5:21,QgFfuy6mnPA
Mounamey,S. P. Balasubrahmanyam;Saindhavi,Anbe Sivam (Original Motion Picture Soundtrack),92,4:38,xKvffSbQV2s
Poovarasampoo - Original,S. Janaki,Kizhakke Pogum Rail,92,4:45,0D00UlwOX2k
Phone,Mickey Singh;UpsideDown,Phone,92,3:32,DmH-BPn0-Q0
Ennamo Yeadho,Harris Jayaraj;Aalaap Raju;Prashanthini;Emcee Jesz;Sri Charan;Madhan Karky,KO (Original Motion Picture Soundtrack),91,5:36,CTQvEx3ajJA
Sollamal Thottu Chellum Thendral,Yuvan Shankar Raja;Vijay Sagar;Hariharan,Dheena (Original Motion Picture Soundtrack),91,5:24,AYUmOcLAQcc
"Ennamo Yeadho (From ""KO"")",Harris Jayaraj;Aalaap Raju;Prashanthini;Emcee Jesz;Sri Charan;Madhan Karky,Endrendrum Harris,91,5:33,fq6egtAzaQM
"Roja Poonthottam (From ""Kannukul Nilavu"")",Unnikrishnan;Anuradha Sriram,Legend's of Music - Hits of A.R.Rahman and Ilayaraja,91,4:51,2g5QFj0cIH8
Kanden Kanden,Madhu Balakrishnan;Sadhana Sargam,Madurey (Original Motion Picture Soundtrack),91,4:49,Syu_E-O-sU4
Orey Naal Unnai,S. P. Balasubrahmanyam;Vani Jairam,Elamai Oonjalaadugiradhu (Original Motion Picture Soundtrack),91,4:32,UgxHuZxuyw0
Olli Olli Iduppe,Vidyasagar;Karthik;Anuradha Sriram,Aathi (Original Motion Picture Soundtrack),91,4:29,blDYk1DF7rQ
Anbendra Mazhaiyilae,Anuradha Sriram;A.R. Rahman,Minsara Kanavu (Original Motion Picture Soundtrack),91,5:51,l6BFZ_oau1Y
Chakkari Nilave,Harish Raghavendra,Youth (Original Motion Picture Soundtrack),91,5:40,uQqk9XsVxjI
Aathangarai Maramea Adhil,Mano;Sujatha,Kizhakku Cheemayile,91,4:50,IQ6orB9du4U
Yedho Yedho,A.R. Rahman;Karthik,Enakku 20 Unakku 18,91,5:49,xkiTKhlN5UU
Vizhi Moodi,Karthik;Prashanthini,Ayan,91,5:32,ZlRqAJpqj30
"Kaadhal Rojave (From ""Roja"")",A.R. Rahman;S. P. Balasubrahmanyam;Sujatha,A.R.R Music Blossom,91,5:03,USDI6SxZMKw
"Love Birds - From ""Anbe Vaa""",P. Susheela,P. Susheela - Birthday Special - Tamil,91,3:38,okLzepu1g2Y
Don'u Don'u Don'u - The Don's Romance,Anirudh Ravichander;Alisha Thomas;Dhanush,Maari (Original Motion Picture Soundtrack),90,3:15,A_z5g0_hJN8
Po Nee Po - The Pain of Love,Anirudh Ravichander;Mohit Chauhan;Dhanush,3 (Original Motion Picture Soundtrack),90,4:11,DnyA_qEbTpw
Anbae Peranbae,Yuvan Shankar Raja;Sid Sriram;Shreya Ghoshal;Uma Devi,NGK (Original Motion Picture Soundtrack),90,4:29,pTHmr_D6sWg
Tamilselvi,Anirudh Ravichander;Nakash Aziz;Vignesh Shivan,Remo (Original Motion Picture Soundtrack),90,3:50,PAhTLB1LBR0
Neruppu Da,Santhosh Narayanan;Arunraja Kamaraj,Kabali (Original Motion Picture Soundtrack),90,3:37,YHV1ElWorVg
Andha Kanna Paathaakaa,Anirudh Ravichander;Yuvan Shankar Raja;Vignesh Shivan,Master (Original Motion Picture Soundtrack),90,3:14,is9J2yQRFRA
Uyire Uyire,Saagar;Na.Muthukumar,Santhosh Subramaniyam (Original Motion Picture Soundtrack),90,4:34,f57W1HuHWPk
"Oru Poiyavathu (From ""Jodi"")",Srinivas;Sujatha,Hits of A.R.Rahman Nenjame,90,7:03,Y34W7D_fDuo
Kalayil Thinamum,Unnikrishnan;Sadhana Sargam;Vaali,New (Original Motion Picture Soundtrack),90,4:23,YmG-j_K-DgU
Pudhu Malar Thottu,Sriram Parthasarathy;Vairamuthu,Poovellam Unn Vaasam (Original Motion Picture Soundtrack),90,4:41,-ntE_TZAN2Y
Swasamae,S. P. Balasubrahmanyam;Sadhana Sargam,Thenali,90,5:48,-2aPml4ij-U
Karuthavanlaam Galeejaam,Anirudh Ravichander;Viveka,Velaikkaran (Original Motion Picture Soundtrack),90,3:28,_oRlyqyEz40
Kanne Kanne - Madras Gig,Leon James;Jonita Gandhi,Kanne Kanne (Madras Gig),90,3:51,Py5ArwIc7z0
"Aasai Aasai (From ""Dhol"")",Shankar Mahadevan;Sujatha,Love Hits of Vidyasagar,90,5:20,jQ74jWBtIjU
"Ithanundu (From ""Dhol"")",Udit Narayan;Sowmya Raoh,Hits of Vidyasagar,90,4:27,h-Se6-F5ok8
Theme of Podaa Podi,Dharan Kumar;Flute Navin;Amalraj,Podaa Podi (Original Motion Picture Soundtrack),90,3:38,yiXjE0NxyoI
Deivam Thantha,K. J. Yesudas,Aval Oru Thodarkathai (Original Motion Picture Soundtrack),90,4:37,X5xgvkleCVY
"Pudhu Malar Thottu (From ""Poovellam Unn Vaasam"")",Sriram Parthasarathy,Tamil Best Love Songs,90,4:41,Dk585TIC8wE
Thom Thom,Vidyasagar;Hariharan;Harini;K. S. Chithra,Alli Thantha Vaanam (Original Background Score),90,4:57,33CnxnYYC8Y
Tharamela Irunthena,Yuvan Shankar Raja,Vaanavarayan Vallavaraayan (Original Motion Picture Soundtrack),90,4:45,UwfFhwkqyFw
"Anbe Anbe (From ""Darling"")",G. V. Prakash,Darling (Original Motion Picture Soundtrack),90,6:16,YR4fS1segho
En Anbe,Harris Jayaraj;Benny Dayal;Sadhana Sargam,Sathyam,90,6:07,WWEjBd6DK4Y
En Anbe,Harris Jayaraj;Sadhana Sargam;Benny Dayal;Yugabharathi,Sathyam (Original Motion Picture Soundtrack),90,6:07,WWEjBd6DK4Y
Che Che,Shankar Mahadevan;Harini,Maja,90,3:47,1ApeaZBDke4
"Kadhal Yenbathu (From ""Oru Kalluriyin Kadhai"")",Harish Raghavendra,Youth Beats - Hits of A.R.Rahman and Yuvan Shankar Raja,90,5:24,GvmUAElaiFQ
Vip Title Song (The Rise of Raghuvaran),Anirudh Ravichander,Velai Illa Pattadhaari,90,3:56,uy9e-Sy0vTA
Manmadhane Nee,Yuvan Shankar Raja;Sadhana Sargam,Manmadhan (Original Motion Picture Soundtrack),90,4:32,CiXEPJaVocw
Vizhigalin Aruginil,Ramesh Vinayakam,Azhagiya Theeyae (Original Motion Picture Soundtrack),89,5:27,gpx7m_lK-zY
"Enthan Kannil (From ""Guru"")",S. Janaki,Kamal Haasan - The Marvel in Movies and Beyond,89,4:15,IEp4idwaMcU
Sweety,Siddharth Mahadevan;Rabbit M C,Race Gurram,89,4:25,zdqFzE9avDM
Kadhal Sadugudu,S.P. Charan,Alaipayuthey,88,4:35,v_DnC3fjbwo
Pachai Nirame,Hariharan;Clinton Cerejo,Alaipayuthey,88,5:58,ySu11Bo0PAs
Suthi Suthi Vandhiga,Harini;S. P. Balasubrahmanyam;Vairamuthu,Padayppa (Original Motion Picture Soundtrack),88,6:27,g1EYT-NZwaQ
Netru Illatha Maatram,A.R. Rahman;Sujatha,Pudhiya Mugam (Original Motion Picture Soundtrack),88,5:09,OBIIEy6tTa4
Thirumana Malargal,Swarnalatha;Vairamuthu,Poovellam Unn Vaasam (Original Motion Picture Soundtrack),88,5:24,_9vTkOnu3fk
"Senjitaley (From ""Remo"")",Anirudh Ravichander;Vignesh Shivan,"Senjitaley (From ""Remo"")",88,4:11,3BXSQS1405g
Come Closer - Sirikkadhey Reprise,Anirudh Ravichander;Inno Genga,Remo (Original Motion Picture Soundtrack),88,3:26,cFhuHxkKgYk
"Sirikkadhey (From ""Remo"")",Anirudh Ravichander;Arjun Kanungo;Srinidhi Venkatesh;Vignesh Shivan,"Sirikkadhey (From ""Remo"")",88,4:05,tiPOguEO5RA
Thanga Changili,Malaysia Vasudevan;S. Janaki;Vairamuthu,Thooral Ninnu Pochu (Original Motion Picture Soundtrack),88,3:59,Gd2P_ONH338
Perai Sollavaa,S. P. Balasubrahmanyam;S. Janaki,Guru (Original Motion Picture Soundtrack),88,4:47,00Rucseox0U
Meesaya Murukku,Hiphop Tamizha;Kharesma Ravichandran,Meesaya Murukku (Original Motion Picture Soundtrack),87,3:42,3kfHArnP1v4
Omana Penne,A.R. Rahman;Benny Dayal;Kalyani Menon;Thamarai,Vinnaithaandi Varuvaayaa (Original Motion Picture Soundtrack),87,5:32,gaKiDGp3r2Q
"Ola Kudisaiyile (From ""Ore Oru Gramathiley"")",Ilaiyaraaja;S. Janaki,"Lullabies of Maestro Ilaiyaraaja, Vol. 01",87,4:31,kOhf2aZ2Fvs
Ale Ale,A.R. Rahman;Chitra Sivaraman;Karthik,Boys,87,6:25,lmEL5Tf773U
Veesum Kaatrukku,Karthik Raja;Unnikrishnan;Harini,Ullasam (Original Motion Picture Soundtrack),87,4:59,8JdSNpGjEZI
"Medhuva Medhuva (From ""Anna Nagar Modul Theru"")",S. P. Balasubrahmanyam;K. S. Chithra,Sangeetha Utsavam - Best Tamil Duets Of Spb & K. S. Chitra,87,4:19,x4K6qkI1z7Y
"Neela Vaanam Odaiyil (From ""Vazhvey Maayam"")",S. P. Balasubrahmanyam,SPB - The Voice For A Millennium,87,4:35,0Ka4kLQB25M
Ale Ale,A.R. Rahman;Karthik;Chitra Sivaraman,Boys,87,6:25,lmEL5Tf773U
